Sign_Order,Sign_Order_Num,Fortune_Level,Poem_Title,Poem_Text,Holy_Meaning,Sign_Interpretation,Meaning_Explanation,Detailed_Explanation,DongPo_Commentary,BiXian_Commentary
第 38 籤,38,丁辛 (下下),關盼盼獨居燕子樓,吟蛩唧唧守孤幃，千里懸懸望信歸，等得榮華公子到，秋冬括括雨霏霏。,莫問財、休鬥訟、遠未回、病且重、婚無成、多怪夢、且禱神、勿妄動。,此籤主有死亡之患。哭泣之哀。凡事不利。有名無實。有始無終。家運凋零。前程蹇滯。作大陰功善事可解。,秋景孤幃。蟲聲唧唧。最爲淒涼苦況。千里懸懸。幾番盼望。等到榮華公子。似是好音。誰知意外不測。又生出一番苦惱。括括霏霏。正是不堪境象。凡事慎守爲佳。,獨守孤幃，只有蟲聲唧唧，是多麼淒涼的景象啊！只有靠着心中的意念維生，盼望着遠方的他能有好消息，好不容易等到了衣錦榮歸的伊人，卻又如夢一場，是那麼短暫，秋風愁雨，苦不堪言，令人哀悽。此籤是如此地悲苦，一切的厄運如影隨形，揮之不去。此時不宜有任何的決定，不如堅守本位，以不變應萬變，靜待世局的變化，再苦的運勢，就當作是上天給你的磨練。,作事無聊、空自惆悵、縱得好音、依然悽憐。謀望不遂、心神徒喪、家道未安、禱神陰相。,不宜問事不宜行、九日常憂十日驚、一段榮華如一夢、翻來覆去總無情。
第 39 籤,39,丁壬 (中平),陶淵明賞菊,北山門外好安居，若問終時慎厥初，堪笑包藏許多事，鱗鴻雖便莫修書。,病擇醫、訟宜解、謹修爲、過必改、財杳茫、名遲疑、婚宜慎、行須時。,此籤宜守舊。不可妄爲。作事謀始。無貽後悔。凡事謹密爲要。不可浪透信息。反此。則有意外之咎。,好安居。現有一安樂境界。慎厥初。須是早爲區畫。不可妄動。事多包藏。自具寬宏之志。修書慎重。莫通鱗鴻之音。機事不密則害成。更防口舌之釁也。,目前處於安樂生活，有點遠離塵囂的狀態。若想知道最後的結果，倒不如從最初開始就及早規劃，則會有美好的未來。你知道的事情相當多，但千萬不可走漏消息，尤其是有人向你打探消息，不如一笑置之，免得招來禍患。更謹防書信上的泄密，不可有‘別人不會知道’的心態，倒不如什麼都不說，將可保有安居樂業的生活。,靜處安身、是非莫理、欲保終吉、作事謀始。無惑人言、切防害己、勿輕傳信、暗中有鬼。,仁裏安居善自全、有時暗地結姻緣、對我好談心曲事、莫將隱奧與人傳。
第 40 籤,40,丁癸 (上吉),漢光武陷昆陽,新來換得好規模，何用隨他步與趨，只聽耳邊消息到，崎嶇歷盡見亨衢。,名終成、訟得勝、孕生男、保無病、行人回、婚宜定、事雖遲、有餘慶。,此籤謀望盡好。須是自己變更。莫聽人言主使。誤走程途。不久好音即到。始雖崎嶇難行。後自亨衢通利。是爲先難後易之象。,規模新換。去舊從新也。何用隨他。自作主張也。耳聽消息。好音即到。崎嶇歷盡。苦去甜來。亨衢。是康莊大路。一往平平坦坦。吉無不利也。佔者須謀爲決斷。志氣堅定始驗。,隨自己的意願做改變，將是最好的選擇，不須受他人的影響，他人的危言聳聽，將使你誤入歧述，要謹防受影響。即將有好消息的到來，儘管經歷過重重坎坷，接踵而來的將是康莊大道，先苦後甘。此籤表示先難後易之象，但最重要的是不要被別人的意見所左右，只要依自己的意願做個大改變，將會有美好的未來。,謀望更改、修爲盡好、何必依人、自可達到。須歷艱難、必獲好報、平步青霄、榮捧恩詔。,改換規模又一般、門庭增喜轉眉顏、文書到手皆成就、宜訟宜婚病亦安。
第 41 籤,41,戊甲 (上吉),李固柳汁染衣,自南自北自東西，欲到天涯誰作梯，遇鼠逢牛三弄笛，好將名姓榜頭題。,訟無定、終有遇、病多憂、擇醫愈、信即到、婚終好、凡所謀、慎勿躁。,此籤現在事務皆無定準。訟必反覆。婚有變易。遇子丑月日。或年分。可許遂意。功名初年艱難。子醜科青雲直上。吐氣揚眉。凡事先難後易。盡人事以待天時可也。,南北東西。乃男子四方之志。天涯遼遠。日前不得階梯。進身無路。待遇鼠逢牛之年。或月日。自有貴人提拔。士人聲譽洋溢。名登金榜。商賈財利勃發。家宅產業興隆。婚姻和合。冤枉申雪。凡事有成。時運未至不應。,男兒志在四方，但卻不知所措，任何一方都無出路，未來遠在天涯，卻不知從何處前進。等到鼠牛年交會之際，會得到貴人相助，可一舉成名或成就一番功業，所以現在要有所準備，一旦時機到來，則會有成。遠在鼠牛年，近在子丑月或日，忍耐目前的困頓及茫然，等待時機。,若求名利、先難後有、白日青雲、必在子醜。聲譽顯赫、題名榜首、百事亨通、顯然在後。,歷涉艱難、求謀未遂、富貴榮華、晚景順利。
第 42 籤,42,戊乙 (中吉),班定遠投筆從軍,我曾許汝事和諧，誰料修爲果自乖，但改新圖莫依舊，營謀應得稱心懷。,病更醫、訟改圖、名與利、換規模、婚別議、行人遲、神力助、謹修爲。,此籤宜反己問心。毋乖神意。恐有惡事惡念。急須改悔。前次所謀不合。從此更新整頓。自有稱心之時。若怙惡不悛。及畏難苟安者。則無濟也。,前事見許。本有機緣。修爲自乖。所謀欠妥。改新圖。另作計較。莫依舊。戒勿因循。營謀稱心。往者可復。失者可追。否則可泰也。凡事去舊從新之象。,原本神明給你一個順遂和諧的道路，但因自以爲是的個性，將天助好意破壞掉了，而且還懷有不好的念頭，在還沒害人之前，就會先害到自己，還是儘快將歹念去除，重新立定目標，只要沒有害人之心，未來更將得心應手，運勢得以否極泰來。不管任何事，都有除舊更新之意。,神許和合、自乖所爲、急須更變、方得其宜。心行正直、毋好自欺、若能悔過、天必相之。,改舊從新別有因、莫乖行止拂天神、管教中路多成就、穩趁舟航涉利津。
第 43 籤,43,戊丙 (中吉),陳平亡歸漢,一紙官書火急催，扁舟東下浪如雷，雖然目下多驚險，保汝平安去復回。,功名遂、好求官、病訟險、終必安、失物在、行人還、婚宜遠、利不難。,此籤先兇後吉。若問謀望。自有好處。病者慮險。自有解脫。訟事驚惶。漸得安泰。宦途主有風浪。終不爲害。凡事存心。默仗神佑獲吉。,一紙官書。乃系衙門公事。火急催者。急如星火也。浪聲如雷。江行驚險之狀。保汝平安。遇險不爲害也。去復回。言去來得以自由。終獲安貞之吉矣。,遇到了不可抗拒的因素，必須冒着極大的風險前往，看起來危機四伏，但在神明的保護之下，均能化險爲夷，最後平安歸來。此簽有先兇後吉之象，雖然遇到驚濤駭浪，但都能平安化解，如果不遇到這些危險之事，也無法進入到平安之境，當進入吉運之後，前面所遇的災難就自動化解消逝了。,官書火急、激聒之兆、目下雖驚、終無紛擾。有神陰扶、收功談笑、往來平安、吉星高照。,先驚未是驚、後喜方爲喜、若問謀事多、連綿無定止。
第 44 籤,44,戊丁 (中吉),留侯博浪椎,汝是人中最吉人，誤爲誤作損精神，堅牢一念酬香願，富貴榮華萃汝身。,事多錯、訟莫作、病禱神、且勿藥、婚莫求、行人還、能自悔、利名全。,此籤本非惡人。卻有惡事。當由見識不明。及被人引誘所致。未免得罪神明。速宜悉心懺悔。力持善願。以冀感應。將來富貴有準。榮華可期。唯在一念挽回。毋終執迷自誤也。,吉人。善人也。言此人向本善良。現在作爲皆錯。損精神。所圖無益。只害自身也。堅牢一念。戒佔者即宜迴心向善。酬香願。言善功久積。心願可酬也。富貴榮華。前因過誤削除。後此善願堅牢。仍萃於一人之身矣。轉禍爲福。明者悟之。,你本來是個心也善良的人，但在周圍引誘之下，做出了錯誤的事情，不僅胡作非爲，還因此傷了自己，趕快重拾善念，用最誠摯的心向神明懺悔，只要迴心轉念，原本善良的心而重新出發，則能彌補之前的過錯，得到神明的幫助，榮華富貴將隨即出現。此籤要告訴你，知錯能改，善莫大焉。,心行平等、反誤非爲、急宜改過、切莫自欺。盡誠作福、神必佑之、榮華富貴、付汝非遲。,萬事皆從忙裏錯、但將心地細思量、若能謹守祈神佑、可保終身大吉昌。
第 45 籤,45,戊戊 (中吉),夏侯嬰滕公君室,好將心地力耕耘，彼此山頭總是墳，陰地不如心地好，修爲到底卻輸君。,心既好、地亦美、病即安、訟得理、財勿求、且守己、行人至、終有喜。,此籤勸人竭力存心。中心爲忠。如心爲恕。凡事人己兩平。不可爲損人利己。及欺心謀吉之事。心地好時。自沐天心庇廕。發福悠長。彼謀吉者。欲得陰地。先損心地。計亦左矣。豈能及存心者之萬一乎。,心地。心中隱曲之處。力耕耘。如力田者之用意栽培也。山頭之墳。彼此皆系祖宗。不可侵害謀佔。陰地猶是地理。心地乃是天理。天理作主。地理隨之轉移。陰地不如心之地。彰彰明矣。修爲。指耕耘心地者言。卻輸君。言不知存心者。未可同日而語也。善惡分途。吉凶自判。佔者審之。,有人爲了求得好運，總是在陰宅上處心積慮，希望求得一塊福地，能夠旺子孫、旺家業，但卻忘了修好心田，如果只是一昧地找好陰地，但心地卻有損人利己之念，最後陰地還是會輸給心之地的。此籤是要人從心做起，只要心中有善念，不蓄意爲惡，就像是一塊良田，在心中滋長，爲人們帶來最大的善報。,好修心地、莫用他求、但依本分、可獲天麻。勿與人競、福力自優、子孫之慶、皆善之由。,人已營謀用意同、好將心地問天公、若還虧卻分毫理、萬事教君吉又兇。
第 46 籤,46,戊己 (中平),馬伏波徵蠻,君是山中萬戶侯，信知騎馬勝騎牛，今朝馬上看山色，爭似騎牛得自由。,名與利、勿貪求、訟莫興、難罷休、行人遲、婚莫許、謹修爲、當靜處。,此籤宜守舊安享。自有山林之樂。不可貪求意外。如其不然。或嫌遲求速。或厭舊而喜新。或舍近而圖遠。或棄小而謀大。如騎牛者改換騎馬。及至騎馬。又想騎牛。懊恨躊躇。勢難中止。事貽伊戚耳。少年未經閱歷之人。每每似此。切宜戒之。,萬戶侯。富貴封王之。山中境遇。暢快者亦不減此。騎牛雖遲得安穩。騎馬雖速冒險阻。馬上看山。言舍安穩而就險阻。不自安常處順也。及至馳驟驚惶。勞苦困頓。不能收繮。卻想騎牛時。安步徐行。何等自在。然已追悔莫及矣。何如先時慎重。勿至輕舉妄動之爲得哉。馬牛。或斷年月亦驗。,明知騎牛才安全，但又貪圖騎馬的快感，當你選擇了騎馬時，就等於舍安穩求快速，但也必須經歷快速所帶來的危險，然而騎在馬上的驚惶，又讓你想要騎牛，但這時已來不及了，你只能心想着安危，無法顧及山上的風景，此籤告訴我們，凡事要謹慎而行，不可想到什麼做什麼，還是要全面考慮。,本等富貴、已勝常人、愈吉愈貪、禍及己身。宜依本分、當享和平、勸君靜處、可免災運。,要作惺惺成懞懂、誰知懞懂作惺惺、多生巧計須成拙、守己方纔事稱心。
第 47 籤,47,戊庚 (中平),楚漢爭鋒,與君萬語復千言，祗欲平和雪爾冤，訟則終兇君記取，試於清夜把心捫。,訟莫興、恐遭刑、財莫貪、病未寧、行有阻、婚難成、且循理、保和平。,此籤。凡事心氣和平。聽人勸阻。錯誤早悔。反自問己。毋使剛愎自用。怙過不悛。致成兇咎。訟事尤戒。雖有怕生冤抑。只宜平情解散則吉。,萬語千言。再三叮嚀也。平和雪冤。情理排解也。如是則可以無訟矣。訟則終兇。一定之理。君記取。戒佔者仔細思量。毋貽後悔也。清夜捫心。謂此事恐欠道理。問心不過。不如及早回頭。之爲愈也。佔此。宜省悟。不可冒昧。宜退止。不慎動作。後患莫測。,一而再，再而三地交待，以和平的方式處理，不可因爲自認有理，就對簿公堂，只要以訴訟的方式處理，則必招來厄運，不可能有對自己有利的結果。不如自己平心靜氣下反問，也許會覺得有失公道，但不是自己認爲的就是對的，只要早日打消訴訟的念頭，則早日去除厄運。不可急進，只宜退守，則不會有難。,訟則終兇、不可多說、若得和平、舊冤可雪。凡所謀望、皆當謹節、反求諸己、禍端自滅。,心地好時身自吉、何須巧計去鑽天、勸君靜處勤修省、禍及身來不可捐。
第 48 籤,48,戊辛 (中吉),竇長君至長安,登山涉水正天寒，兄弟姻親那得安，不遇虎頭人一喚，全家誰保汝重歡。,遇貴人、訟和平、病驚險、莫求名、財物耗、婚宜停、逢寅字、事漸亨。,此籤景況艱難。人口欠安。凡事類多齟齬。幸轉眼之際。恰有一貴人從中得力。誠以指示迷途。須識機緣所在。悉心聽從。自得骨肉團圓。人情和合。凡謀遂意矣。否則倀倀然之。豈有安全。保聚之樂乎。,登山涉水。謂涉歷艱難也。兄弟姻親。合內外言。那得安寧。內外不寧也。虎頭。謂盧虞之姓。或虔州處州上虞虞城各地名。一曰晉顧愷爲虎頭將軍。應在顧姓。必得此人。爲之喚醒。自保安泰。重歡。謂離者可使複合。失者可使復得，危者可使復安也。若遇此人。而不知省。則失之矣。,目前正處於混亂險阻的狀況，全家大小兄弟姻親間全都不和，鬧得全部雞犬不寧。虎頭人，表示姓盧或虞等有如虎頭字的人或屬虎的人，經過此貴人的指點，將破除兄弟內外之間的不睦，重修舊好，家運將轉危爲安。但是當遇到虎頭姓的貴人而不自知時，可能會失去這個大好機會，不得不注意，千萬別失去這個可讓家運好轉的良機。,歷涉艱難、時運輒左、家道不齊、事多坎坷。遇富貴人、提挈方可、倘無所濟、難逃後禍。,先難後易本天然、幾度勞心事不全、若得貴人提挈處、管教騎鶴與腰纏。
第 49 籤,49,戊壬 (下下),張子房遁跡,彼此居家只一山，如何似隔鬼門關，日月如梭人易老，許多勞碌不如閒。,名利阻、且休問、訟宜和、病有願、婚姻遲、行人遠、欲獲吉、且安份。,此籤主情意隔角。不遇扶持。看似密邇相連。其實咫尺天涯。勢同秦越。智士知己知彼。舍此另投。或有遇合。若信。文貌周旋。口頭熱鬧。外密中疏。終鮮實際。不唯耽誤時日。更費趨候奔走之勞。此等人爲世詬病久矣。奈何其弗之省也。,彼此家居。誼屬鄰里。只一山。過從甚便也。鬼門關。言其肝膽隔別。不啻陰陽分界也。歲月如梭。言盼望無期。空自遲誤。許多勞碌。言所倚非人。所謀非計。枉受奔波之累。則何如識透人情。消閒自在。其不綽綽然有餘裕哉。戒佔者勿妄交。勿枉己。勿輕信。,雖然與周圍的人看似親近，但卻從未真心地相待過，猶如陰陽兩界，是無法跨越的。在快速的時間飛逝下，人也漸漸地不再年輕，但總是所託非人，無法成事，白忙一場，倒不如什麼都不做，生活過得倒還比較自在。此籤表示無法和他人情意交流，無法相信別人，只相信自己，但又交待錯人，一生都是如此，所以別再相信不該相信的人了。,安閒易處、出門有阻、時迍易過、枉自勞苦。且宜守舊、隨分而去、運未亨通、那宜進取。,形跡如親實不親、相看只作鏡中人、謀爲動作皆無定、只恐虛名不得真。
第 50 籤,50,戊癸 (上吉),牛宏不聽射牛,人說今年勝去年，也須步步要周旋，一家和氣多生福，萋菲讒言莫聽偏。,出入吉、財物多、孕可保、病即瘥、婚易成、訟宜和、問行人、奏凱歌。,此籤主年運亨通。時和歲稔。家旺人興。然修身乃齊家之本。禮教實門內之防。必須周規折矩。仁讓雍雍。方遂和平之福。更忌婦人搬弄。宵小離間。是爲萋菲讒言。不可偏聽。斯家道成而流澤長矣。凡事謹慎和平則吉。,今年勝去年。人事漸漸順利。步步循規矩。舉動不可疏虞。和氣致福。須宜妻子。睦兄弟。感召吉祥。讒言莫聽。須存見解。厚包容。慎防偏倚。凡事盡人事以應天時則可。恃天時而廢人事。則不可。可不慎諸。,今年明顯地比去年要好，運勢也漸漸順遂，只要亦步亦趨地循規蹈矩，全家和樂融融，則會有更多的福氣，要小心女人間的是非，言語離間是破壞的導火線，不必過於聽信，得來不易的好運不可因此而破運。此籤表示要從人和做起，等到適和的天時，則會旺家旺族，不可等到時機已到，纔要調整人事，則會浪費天助好運。,謀望勝前、卻宜進取、人事周旋、禍消福至。勿信讒言、惶惑思慮、慎終如始、切莫顛墜。,剝復亨迍遞往還、今番管許勝前番、婦人言語君休聽、家道興衰在此間。
第 51 籤,51,己甲 (上吉),御溝流紅葉,君今百事且隨緣，水到渠成聽自然，莫嘆年來不如意，喜逢新運稱心田。,名漸顯、訟漸寬、財自裕、病自安、行有信、婚可定、命漸亨、心必稱。,此籤暫時安分。後此漸有機緣。不求自至。切勿因近年謀爲不遂。常自嗟嘆。人事有得有失。命運有否有泰。一到亨通之時。名成利就。自有吐氣揚眉之日也。,百事隨緣。言目下聽天安命。不用強求。水到渠成。言水勢所到之處。自成溝渠。原系自然之理。非人力所能逮也。前不如意。往事困頓之境。喜稱心田。後此行運之時。凡事不可欲速。久久自有成就。,過去也許有點受阻的感覺，但凡事只宜隨遇而安，不可過度強求，運勢走到此時，有水到渠成之勢，只要順其自然，一切將會相隨心轉。不要怪罪過去的不順遂，如果只會怨天尤人，就算好運來臨也只是擦肩而過，以歡欣的心情迎接好運勢的到來，一切將會更稱心如意。此籤表示一時的受阻，不必太在意，即將來臨的好運纔是值得珍惜的。,目下謀望、且隨緣分、一朝榮達、身顯如願。休自嗟怨、待時遷變、漸遇亨通、好事疊見。,一生勞碌不曾閒、幾度牽纏名利關、漸遇亨通堪稱意、後來容易只先難。
第 52 籤,52,己乙 (上吉),鄧仲華杖策渡河,兀坐幽居嘆寂寥，孤燈掩映度清宵，黃金忽報秋光好，活計扁舟渡北朝。,名晚成、利遲得、病漸安、訟終息、孕無驚、婚姻吉、行人回、事勝昔。,此籤現在光景落寞不堪。幾無復有起色。豈知通塞無常。剝復遞轉。不意之間。頓有好音。自北而至。或已向北而往。名利即在此中。滔滔順利。凡事有意外遇合。,幽居寂寥。無人援助。孤燈掩映。形影自憐。極言寒微不堪之苦。秋光好。主秋間有好消息。黃金。即一紙家書抵萬金之意。渡北朝。應在北方。活計扁舟。言輕帆徑渡。活計在指顧間。可不勞而成也。先憂後樂。待時則吉。,目前處於時運不濟之時，度過無數個孤獨寂寥的日子，意味沉寂地等待，終於等到好運的到來，大約會在秋季，而且是忽然間就會有好運來，將原來停滯不前的運勢，一下子就打通了，而且輕鬆容易地過生活，完全沒有生計上的問題，好運或許來自北方，或是必須往北方去，一切在命運中，自會有安排，目前的困頓將是未來順意的基石。,席珍待聘、休嗟未遇、忽際明時、青雲穩步。好音一來、得意高舉、凡事必諧、皆有佳趣。,幾載青雲志未酬、此心憂處不成憂、庚辛得遇真知己、破浪乘風作勝遊。
第 53 籤,53,己丙 (下下),劉先生入贅東吳,艱難險阻路蹊蹺，南鳥孤飛依北巢，今日貴人曾識面，相逢卻在夏秋交。,病與訟、皆不利、名與財、亦阻滯、孕有驚、行未至、若遇貴、事方濟。,此籤歷涉艱險。謀爲不遂。不知避凶趨吉。反自捨安就危。與南鳥北巢何異。須待貴人得力。幸今日已經識面。將來夏秋之交。必有應驗。名利可成。婚姻可合。孕育可許。凡事先有機兆。而後成之。,艱難險阻。事緒紛擾之象。路蹊蹺。顛墜不可保也。南鳥北巢。言其流離失所。不可安處也。貴人識面。今日已有機緣。可望提拔。相逢夏秋交。言應在夏間。或秋間。或夏秋相接之際。於此時必得貴人之力。可無艱難險阻之憂矣。佔者須待人而行。擇人而與則吉。,總是比別人多花許多的力氣，還是倍受阻難，而且顛沛流離，重重難關，似乎永無天日，運勢無法順遂，就如南方的飛鳥獨自朝着北方而去，等着它的是冰天雪地，並非春暖花開的天堂，也可說是去錯地方了。如此的阻運必須有貴人相助，纔能有所改變，你的貴人是你已認識的人，但是必須在夏秋之交再度重逢，你才能因貴人的指點而改變運勢。要注意貴人的出現，不要錯失轉運的好機會。,艱難歷遍、作事皆非、南鳥北巢、失其所依。夏秋之交、貴人相提、應稱謀望、榮達可期。,謀爲先阻後還亨、此際心機莫亂行、若得貴人提拔處、諸般方可事圓成。
第 54 籤,54,己丁 (中平),蘇秦十上書,萬人叢裏逞英豪，便欲飛騰霄漢高，爭奈承流風未便，青燈黃卷且勤勞。,財未遂、名未超、訟不宜、病未消、婚難信、行路迢、待時至、百事饒。,此籤主功名沉滯。時運未濟。雖然自逞英豪。志圖衝舉。然如舟楫未及洪流。鴻毛不遇順風。仍須守待。唯用功於青燈黃卷之中。皇天不負苦心人。將來自有發跡。慎毋欲速。毋怠惰。功夫既到。天機自合耳。凡事以艱難得之。,英豪。指奇傑之士。萬人頭上。超出萬人也。飛騰霄漢。自負一蹴青雲之志。然事勢有次第。時運有遲速。承流風未便。時未可。勢未可。如魚不得水。鳥不得風。何能快意順利。黃卷青燈。士人本業。守勤勞。用功待時也。時至方許稱意。現在宜守舊。宜安分。不可妄爲。,想要超出衆人之上，而且自負有超脫的能耐，只可惜天地萬物有序，並非有崇高的理想，就一定能達成，必須等待時機的到來，現在是時運不濟之時，就如船遇淺灘、羽翼無法順風，無法依自己的意願而行，必須努力度過這暗潮洶湧的困境，等待好運勢的到來。目前必須努力在讀書或自修上，人在困惑之時，可從書本中找到答案，而且不可有懈怠之心，必須勤勞努力，等待好運。,謀望過高、便其遠到、爭奈時乖、徒自狂躁。且宜守己、勉行善道、直待時亨、凡事皆好。,強取強求不自知、箇中綿力本差池、狂風逆水皆爲患、險阻艱難在此時。
第 55 籤,55,己戊 (中平),包龍圖勸農,耕勤力作莫蹉跎，衣食隨時安分過，縱使經商收倍利，不如逐歲廩米多。,休問貿、莫貪財、訟宜解、病無災、婚可就、遠行回、戒出入、福自來。,此籤戒營謀務本。衣食隨緣。不可貪求。不可過分。若務商賈奇嬴之利。必至使用心機。慣行刻剝。財利終不永久。何如耕作勤儉之人。自食其力。倉廩充實。豈非裕後傳家之長計乎。凡事宜守舊。仕人不可改商。定主虧折。若由商改士則吉。庠序食廩米。仕宦食廩祿。,耕勤力作。農家本計。莫蹉跎。戒勿虛度歲月也。隨時安分。戒不可貪求意外之事。經商倍利。乃逐末者所爲。終不可恃。廩米多。言田家力田。逢年倉廩廣積。較經商爲安穩也。大衆宜靜不宜動。宜勤不宜惰。宜儉不宜奢。宜約不宜貪。佔者審之。,努力耕作不懈怠，則會衣食無缺地過着好日子，所謂的耕作是指實際操作的工作，並非是從事商業，此籤告戒不宜從商，雖然從事商業有更大的收穫，但利益大的事情風險也很大，眼前的利潤有背後的風險，可能會有更大的損失，無法有穩定的收入，倒不如從事公務員，可以有穩定的收入，長時間的累積，也比從商要好很多。此籤建議，如果目前從商，必須改行從事穩定收入的公職較好。,衣食自足、強求則損、不如歸耕、種植爲本。縱巧經營、豈能長遠、安分守成、榮達未晚。,守己須防巧用心、皇天有眼不虧人、只宜安分休更改、恐怕災殃及汝身。
