Sign_Order,Sign_Order_Num,Fortune_Level,Palace,Current_Hexagram,Change_Trigger,Changed_Hexagram,Fortune_Category,Five_Elements,Symbol_1,Symbol_2,Symbol_3,Symbol_4,Symbol_5,Poem_Text,Interpretation
第 1 籤,1,上上籤,乾宮,乾,九五,大有,持持,金,火,水,土,木,金,天門一掛榜，領定奪標人，馬嘶芳草地，秋高聽鹿鳴。,讀了這首詩，也許會令你心花怒放、樂不可支。是的，它的確是大吉大利的。高高的天堂大門上，張掛着中標的榜文、而你的名字，赫然在上，往日的汗水，沒有白流，你終於脫穎而出，名列前茅，出人頭地了，駿馬在芳草如茵的原野上，放開四蹄，自由奔馳，引頸長嘶，聲震長空，好不得意秋高氣爽的季節裏，傳來一陣陣小鹿的鳴叫，宛如陣陣樂曲，歡快而又動聽、似乎在祝賀你的一次大成功。這一切彷彿都是預定好了似的，合乎上天的旨意。這首籤詩預示不論你是求升學、評職稱、謀事、事業等等，都將給你帶來升遷的喜慶機會，當然可以放心了。 這裏有兩處小地方可不能忽視：馬，善於奔跑，在易經八卦裏屬於乾。乾相對應的方位是西北，相應的季節是秋冬之際，五行中屬金。同時，馬在十二生肖中也獨佔一席，壬午、甲午、丙午、戊午、庚午分別代表42、54、66、78、90年。午也決定了馬的月份是農曆六月。你能聯繫自己找到更多答案的。
第 2 籤,2,上上籤,坤宮,坤,六五,比,持持,土,木,金,火,水,土,地有神，甚威靈，興邦輔國，尊主佑民。,八卦中乾代表陽、天、金、坤所代表的是陰、地、土。《煬帝開河記》中記敘了隋代修運河的典故。其中也說：“雎陽地靈，不可干犯。”四大菩薩之一的地藏菩薩，就是主管陰間的幽冥教主。他曾大發誓願：“地獄未空，誓不成佛”，說是直到地獄冤鬼渡盡，再沒有一個“罪鬼”受苦，自己才願成仙。可惜，六道輪迴永無休止，地獄成空也遙遙無期，所以，地藏王也就永難成佛，始終擔任輔助佛的菩薩職務。每逢農曆七月十五和七月三十，是地藏王的生日和成道日，成羣的朝拜者便湧至安徽九華山佛教勝地，頂禮膜拜、許願還願。 這條籤所寓意的是：所求的事物和人，均屬地神所主宰，所支配。坤屬土，土能生金，被木所克。坤所對應的季節是夏秋，方位是西南。時間上所對應的地支是申和未，年代分別是43、44、55、56、67、68、79、80、91、92年，月份是農曆六、七月。時辰是下午2點至4點(夏令時)。
第 3 籤,3,中上籤,坎宮,屯,九五,復,持平,水,土,木,金,火,水,長安花，不可及，春風中，馬蹄疾，急早加鞭，驟然生色。,春天的長安城，鮮花盛開，絢麗多彩，多麼令人神往。可是，這些花可以想可以望而無法攀折在手。你朝着目的地快馬加鞭、日夜兼程往前趕，卻在無意之間有了一個意外的收穫，使你驚喜不已。得到的，不是所追求的，雖然不盡人意，卻可以寬慰你。 古城長安(今西安市)，是我國六大古都之一，籤中所指的長安，不要單純理解成今天的西安或者首都北京，這裏泛指求的人與事之所在地。所追求的是花，而不是果，虛而不實，當然不會有直接的收穫。 你不應在追求的過程中，慢慢吞吞，虛耗了歲月，要以最快的速度去接近目標，或許會有一個意外的收穫。
第 4 籤,4,中上籤,離宮,蒙,九二,剝,持平,火,水,土,木,金,火,春花嬌媚，不禁雨打風飄，秋菊幽芳，反耐霜凌雪傲。,擺在你面前的，有兩個不同類型的追求目標，因此你心上心下，躊躇不決，不知如何是好：春花，還是秋菊？神籤回答你說：“秋菊好。雖然它沒有春花那麼嬌媚，卻凌霜傲雪、挺拔堅強。 春所對應的八封名叫震，方位是東方，屬五行中的木。木能生火卻被火所克。 秋所對應的八卦名稱兌，方位是西方，屬金。金由土生能生水，卻被火所克。 春花也罷秋菊也罷，畢竟都是被動之物，佔據主導地位的是你自己。 陰陽五行是個哲學概念，包含着事物對立統一的兩個方面。 你的命運八字中，木、土、火、金、水，旺盛的是什麼，缺少的是什麼，與春花秋菊，有什麼對應的相生相剋的關係？這是值得查詢一下。然後再作結論的，那時你纔會心服口服，頓悟其中道理。
第 5 籤,5,中下籤,震宮,震,六五,隨,平破,木,火,土,金,水,木,春雷震，夏風巽，臥龍起，猛虎驚，風雲會全，救濟蒼生。,這是一支充滿希望、顯示外來肋力的籤，並預示了你所祈問的事情不同尋常的意義。春雷、夏風分別象徵着八卦中的震卦和巽卦。 震。所對應的方位是東方，季節是春天，五行之中屬木。震也是雷神的象徵。東方的神只是青龍。這條沉睡的龍終於醒來，充滿了活力和生機，使百獸之王的虎，受到晾嚇，只好收起它的虎威。灰溜溜的逃遁。 你所營求的事情中，有一個對頭。處處時時。有意無意。給你製造一個又一個阻力和障礙，但終敵不過風神和雷神的合力挾擊，敗在你的手下。記住，這個人屬虎，生於1938年、50、62、74、86、98年。當然，臉有更大的目標要去追求，加上你的度量，你不會將對方怎麼樣的，完全沒有必要施行更大的報復。 巽，是風神的象徵，在五行當中也屬木，時間正是春夏之交。
第 6 籤,6,中下籤,坎宮,屯,初九,比,平破,水,木,火,土,金,水,非玄非奧，非淺非深，一個妙道，着意搜嫂尋。,“道”是什麼？真是一言難盡。老子創立的古代哲學思想流派，以“道”爲指導思想、行爲準則及最高信仰。道，本義爲道路。引申爲規律、原理、準則、宇宙的本原等。 “道之太原出於天，天不變，道亦不變。”事物變化的普遍規律是不以人的意志爲轉移的。所以人要順天道而行。按規律辦事才能無往而不利。 掌握事物發展規律，是一個認識的過程，由量變到質變的過程。這個飛躍、古人稱之爲：悟、頓悟。未悟之前，恍恍惚惚。道在你的眼中玄妙高深、若明若暗、深不可測。一旦悟道，頓時一片光明，使得到了超凡脫俗的大智大慧。 “朝聞道、夕死可矣。”所以人們往往窮其一生苦苦追尋，希望早日得道。 這條籤是給你的人生作出方向性的導引，也對目前的你，提出指南：知不可爲而爲之，是—種盲目的行動，失敗是必然的。
第 7 籤,7,中下籤,坎宮,坎,九五,師,平破,水,木,火,土,金,水,君須悟，勿誤疑，有平路，任驅馳，隨時變易，件件咸宜。,一條平平坦坦的陽關大道，出現在你的面前，召喚你放開繮繩，朝目標的終點飛奔。你該清醒地看到。不可猶豫不決，這會耽誤大事的。可是，在出發之前，還是要結你一個忠告：你可不能一條道跑到黑，不可用一種一成不變的老法又去面對未來。該要放慢速度時要放慢速度；該要轉彎的時候，一定順勢拐彎；該休息時要休息。總之，要根據不斷變化的形勢，改變不同的辦事方法。 這樣，你就能進退自如，取得一個接一個的小勝利。 祝你積小勝成大勝。
第 8 籤,8,中上籤,坎宮,革,九五,豐,持平,水,土,木,金,火,水,虎戀高山別有機，衆人目下尚狐疑，雁來嘹嚦黃花發，此際聲名達帝畿。,戀守高山的猛虎，看似無所事事，悠哉遊哉。但卻不然。它養精蓄銳。別有心機，處處都有其獨到的見解。當其它動物還在懵懵懂懂、猶疑未決的時候，它早就成熟了攻擊的全套方案，並且準備開始去實施。好一個百獸之王，你就是那虎，你L問什麼呢？成功的深度和時機，對嗎？” 大雁南飛的時候，秋意漸涼，黃色的菊花還在星星點點地開放。這使你成功的幸運季節。黃花，也是金的象徵，預示你求利得利。種瓜得瓜。更值得慶幸的是，事情的成功。將會使你譽滿京城。雖然這也許有點誇張，但畢竟會名利雙收。 總之，“不鳴則已，一鳴驚人。” 注意。你要在行動前守口如瓶，不要將心事隨便向人透露，否則大不利。
第 9 籤,9,上籤,離宮,訟,六三,姤,持,火,水,土,木,金,火,貴客相逢更可期，庭前拈木鳳業儀，好將短事求長事，體聽旁人說是非。,你的輝煌的人生階段，還沒有到來。可是，不要緊，很快地，有一位高貴的朋友，就要來到你的身邊。他(她)將改變你的外境，引領你趨向成功，你需要做些準備，注意居地的環境，屋前屋後的風水，修茸一下，稍稍動此土木工程。另外，改變一下牀的朝向。你的個性也很關鍵，幾乎給你一生帶來特大的影響。你是一個痛快人，往往只想到用員簡單的方式去解決最複雜的問題，只圖個痛快，而忽略了後果，“好將短事求長事”，好在這兒讀第四聲，偏好，偏向的意思。不管人家怎麼說三道四議論你、攻擊誹謗；甚至指名道姓當面誣衊你、污辱你，我都要淡然處之看得開，千萬不要簡簡單單、冒冒失失地幹蠢事，一切要從長計議，朝遠處想。 朋友，願這位姓氏中帶有草、木的貴人早日來臨；願這條籤詩陪伴你的一生，時時刻刻給你以警醒。
第 10 籤,10,上上籤,離宮,訟,初六,履,持持,火,水,土,木,金,火,嘹嚦證鳴獨出羣，高飛，羽翼更也紛，雲程北進，好音逐聞，朝雲暮雨，交加有憑。,空中傳來陣陣雁鳴，嘹亮的合唱聲。劃破了大地的寧靜。瞧，那隻領隊的鴻雁，多麼出色，與衆不同！它高高地飛翔着，展開寬厚的雙翼，抖出八面威風，引領雄糾糾的雁陣，傲迎北來狂風，穿雲破霧，聲振長空。 你就是這隻出衆的頭雁，抽中這支籤的朋友，你勇敢，你自信，你時時刻刻都想出人頭地，當然也曾如願以償，出過不少風頭。 如果你的生肖正好屬雞，你會明白我說得一點兒也沒錯。 當然，其他屬性的人，也會大同小異，因爲你生性如此，潛意識裏充滿了“爲天下先”的渴望。 這支籤，給你指出了發達的幸運方向：北。在那個方向，會使你接連不斷地獲得成功的快樂，好消息追逐着你的身後，請你特別留意天氣變化明顯的日子，不要輕看了這個有憑據的一天，將來必有驗證：農曆三月初三。
第 11 籤,11,下下籤,乾宮,否,六三,遁,破破,金,水,木,火,土,金,無蹤又無跡，遠近難尋覓，平地起風波，似笑還成泣。,這支籤，主要回答有關人口走失及物品、家畜丟失的卜問。很遺憾，回答是否定的。你只當是退財消災折禍吧。人口定失。也只當是被高人導入深山大澤，經過修練必會得道飛昇但願迷失的不是你自己。因爲那會使你一陣陣清醒一陣陣糊塗，在別人眼裏你是個精神病患者，不可理解。而你自己卻清醒得很，精神病人才是他們，那些用怪怪的眼光盯着你的人。 但不能排除引起這一切不幸的原因，是觸犯了地煞的可能。歷代陰陽家謂：每日均有當值的兇惡神煞，名目繁多。衆煞，以劫煞在此籤中表現特別顯著，主動盜傷殺。表現時間爲： 午戊歲在亥月(寅午戌月在亥日，寅午戊日在亥時，下同)，亥未歲在申，申子辰歲在巳，巳酉醜歲在寅。爲了進兇趨吉，你頭最好有本《萬年曆》，這樣你將很容易掌握準確的時間。另，有條件的話，最好能去拜拜地神，拜禱土地公公、土地婆婆們正管着這檔於事呢。
第 12 籤,12,中下籤,坤宮,夬,初九,大過,平破,土,金,水,木,火,土,神黯黯，意悠悠，收卻張，莫下鉤。,這不是一以稱得上吉利的籤，儘管不爲大凶，你仍可以當作一個警告。雖然沒有說出個讓你不要着手去幹的原因，也沒有指出何方來的干擾，怎樣加以提防，就名象一個懶得多作解釋的兄長：“收線吧，別再於下去了。”可是，想一想就會明白，阻力來自於你自己。“神黯黯”，你的神形不夠光彩，精神狀況不佳，這樣你的意念自然難以集中，怎麼能夠釣到你的目地物—那條悠悠然的魚呢？ 世上沒有常勝將軍，也沒有終生的失敗者，不過，這一次你是無法戰勝它的，這條魚，悠哉遊哉，快快樂樂，充滿了生機和靈性。 所以，聰明的做法是放棄這個追求，退守原位，養精蓄銳，以待時機。
第 13 籤,13,中籤,乾宮,乾,九二,同人,平,金,命,命,命,命,命,得意宜逢婦，前程去有緣，利名終有望，三五月團圓。,你這個人，叫我怎麼說你纔好？你辦事全憑着自己的興趣，沒有多大的勁差別，也沒有什麼計劃性，更缺乏持之以恆的毅力和耐性。雖然你意氣用事，但卻太陰星高照，一生盡遇女貴人，逢凶化吉，無往不利。這一次，本也有不祥之兆，弄得你心神不寧，可是，這回又被一位女性貴人給你化解開來，使你轉憂爲喜，名利雙獲。而且，日子就在近期，三五一十五天內定可分曉。不要高興得太早，聽我說完。 你不可以在近期內，去探視病中的親友，也不要去參加一位女性長者的追悼會和喪葬事務，這樣才能被動祛災避禍。飲食方面也有禁忌：生長土內蕨類植物，如薯、筍、竽艿、參類藥物。 最好能參拜觀音菩薩，祈求庇佑。
第 14 籤,14,下下籤,艮宮,睽,六三,大有,破破,土,金,水,木,火,土,鼑沸起風波，孤舟要渡河，巧中藏卻拙，人事轉嗟跎。,鼎沸，原意爲油鍋被燒滾了的意思，可見這場風波非同小可。不是這場風波的當事人之一，所以想跑，躲過一時是一時，想要一個人單獨離開風波是非之地，一走了之，越遠越好。但結局卻與你的願望大相徑庭，那時你才發現自己太笨了，連這起碼的俗話都忘了：組得了和尚，跑不了廟。正確的做法是不跑，勇敢地去承擔自己的過失。該自首的就去自首，該道歉的就向對方主動道歉，該罰則罰，該賠則賠。 舉頭三尺，便有神靈，人不報應，天亦報應，你躲得過哪一時呢？ 這場風波終究將改變你的命運，從此將走一段相當艱澀的歷程，而且時間也會很漫長。但你不必灰心，我的朋友。你在今後，要多做善事，多做有益於衆人的事情。儘量避免與人閒聊，以免口角生非。適當調整飲食結構，不要喫冷膩的牛肉、羊肉及雞、鴨、鵝。
第 15 籤,15,中下籤,兌宮,鹹,初九,革,平破,金,水,木,火,土,金,意在閒中信未來，故人千里意徘徊，天邊雁足傳消息，一點梅花春色回。,你問千里之外的那個人嗎？一個字：忙。終日裏東跑西顛，連想念你的時刻都幾乎沒有。人在忙裏，意在閒中。頭腦裏除了工作還是工作，繁冗的事務，紛陳雜沓，累得他不勝負荷，倒頭便要睡覺休息。夢裏？夢裏也是工作，壓力太大了。沒有給你寫信，只好話你原諒了。不過那也只是暫時的，不久你就會收到來信的。古人以雁足傳書象徵信息的傳遞，寄託了異地親友的相思。 這個遠方的人，到你身邊的日子是鐵定了的：一點梅花春色回。也就是說年底，臘盡春還的時候，將與你一起團圓重聚，歡度春節。 你要做的事情自己去做就是，同時也應去參拜菩薩。祈求對方在外平安順心，身健體康。何方之神可託，西北方位，如來佛祖。因爲在易經八卦中，乾代表西北方向，代表馬。此外，你要保護、照顧好自己的頭部，不要受到風雨及意外的傷害。夜裏子時，千萬不要洗溼了頭髮。
第 16 籤,16,中上籤,離宮,同人,六二,乾,持平,火,水,土,木,金,火,心私同事知，同門外好施，功交如，事有終。,你心性平和、沉穩、待人熱情、誠懇、素來頗受同事、同學、親友的喜歡，受到普遍的尊重，廣有朋友緣。你卜問的這件事情，關鍵在於合作者，這樣一個合作者與你相識的時間不算長，但倆人一見如故，要謀的事也能一拍即合。 這樣一個合作者，最好不是你的同行、同事，也不要沾親帶故，這樣才能保證取行事半功倍的效益。功交加，就是事半功倍的意思。 換一句話說，此人須不在原有人際圈內，方爲稱心的合作者。另外，你要注意保密。有要輕易泄露出去，那樣將會添亂。 總之，事情會善始善終，得到圓滿妥善的解決，放心好了。
第 17 籤,17,上籤,乾宮,乾,九四,小畜,持,金,火,水,土,木,金,欲行還止，徘徊不已，藏玉懷珠，寸心千里。,這支籤令人費解的是最後一句：寸心千里。寸心爲“忖”。付，猜度、權衡的意思。千里爲“重”，重是慎重的重。總的說來，是讓你多多動腦子，不要輕率行動，草莽行事，還是緩一步再動爲妙。 這不是在猜謎語、作遊戲嗎？這種測字的預測法暗含在籤詩中，曲折一些，靈性的原理卻是一樣，亦可取得殊途同歸的妙處。 因爲你懷中之物，藏藏掩掩，不同凡響，可說是稀世珍寶了。 當然，你也就不便輕易露白於世。但似乎亮出採纔會找到一條財路，可以升發，那結局將是很能誘惑自己的，因此，又有也蠢蠢欲動。所以，你不免有些猶豫。 你一定不要憑着一時的衝動。做出於自己不利的事來。時辰未到，萬不可輕舉妄動，須暫時停頓下來，靜觀變化。有如山止。 記住：百動不如一靜，事緩則圓。
第 18 籤,18,中籤,乾宮,乾,上九,夬,平,金,命,命,命,命,命,心慼慼，口啾啾，一番思慮一番憂，說了休時又不休。,這是回答有關戀愛和婚姻的一支籤，如果你卜問的事與此無關，知情可以推衍出相近的結論。你問目前這位戀人或配偶到底適不適合自己，對方會不會主動拋棄自己，或者自己是不是應當主動離開對方？離開後到底於我有利還是有弊？ 人的感情世界，多姿多彩，紛紛雜雜。各種社會關係人際關係也繁複而微妙，往往是牽一髮而動全身。所以，說了休時又不休，欲罷不能，優柔寡斷。其實這從籤詩上可以看出，不分開當是定局。這是天意。倒是弄得自己悲悲慼慼，時而長吁短嘆，時而瞅瞅自語，委實是種大可不必的自我傷害。 陰和陽，兩兩相交，又互爲補充。互相對立，相反相成。所謂“陽盛陰衰”、“陰盛陽衰”的不均衡現象，生活中常有發生。不管這種位置如何失當，最要緊的是調整好自己的心態，才能明白自己的“勢力範圍”應當處於消、還是長的態勢，纔會擺平心靈的那碗水。
第 19 籤,19,上上籤,艮宮,履,初九,訟,持持,土,木,金,火,水,土,不遠有近，似易似難，等閒一事，雲中笑看。,這條籤如果光認字面上看，淺顯明白，很容易被人忽視。其實，中間深藏着玄機，不經點破，是難以弄橫的。原來這件等閒的小事，這件不遠不近、似易似難、中不溜兒的事情要辦得完善的話，關鍵在於“雲中笑看”。易經八卦裏，乾、坤、震、巽、坎、離良、兌所對應的自然事物分別爲天、地、雷、風、水、火、山、澤。按照今天的常識，誰都會認爲雲是由水蒸氣凝聚而成，主要構成成份應爲水。那麼，籤詩中的雲是不是代表水，代表“離”封呢？錯了。古人認爲雲是當風聚集而成的，所以，將雲歸爲風一類。也就是說，對應的封應當是“巽”。 巽卦，所對應的方位是東南，季節是春夏之交，所對應的動物屬相是雞。屬性是人，這個人含進人、進一步、滲透等意思。 你將這些與自己卜問的事，聯繫在一起反覆考慮幾遍，就會頓然大悟的。
第 20 籤,20,中上籤,艮宮,履,六三,乾,持平,土,木,金,火,水,土,桃李笑春風，西飛又到東，家中無意緒，船在浪濤中。,桃花紅豔，李花潔白，競相開放在盪漾的春風裏，休浴着和煦的陽光，綻定出朵朵的笑靨。你像一隻辛勞的蜜蜂，離開了溫馨的家，四處奔波。又像一隻彩蝶，貪戀花叢，上下翻飛，洋洋自得，興味盎然，樂而忘歸。一時間，你忘記了你不應當忘記的一切，你的家，你的親人，你的責任，義務，你的名聲，你姓什麼，叫什麼？快樂裏蘊含着憂愁、風流、放縱將會使你付出難以想象的代價。你生命之舟在驚濤駭浪裏顛簸、搖盪，將有頓覆的危險。 你能掙扎並脫離這片苦海嗎？廣義上來說，這種偏桃花運是背運，因爲接踵而來的是災難。除非你不在乎聲敗名裂，除非你不再關心自己的親人。不怕他(她)受到凌辱和傷害，你當然可以不相信神靈在這支籤裏給你的忠告。
第 21 籤,21,上上籤,離宮,同人,上九,革,持持,火,水,土,木,金,火,一水遠一水，一山旋一山，水窮山盡處，名利不爲難。,這是支求名利的問事籤。此去前途山水相逢，頗有一番周折，貴在堅持，恆心不變，挫折不搖，意志堅定。兩次以上的波折中，你都能應付自好，順利通過，表現出你不同尋常的意志和智慧，最後將取得圓滿的成功。 當然，你也有着應當留心的事項，必須高度警惕，加意提防。 第一個回合中，要盯牢一個屬陀的人，防範加害。而給予你援助的是一位屬羊的朋友。另處，你不能用第一次波折的經驗去套用在每二次波折中，你也絕不要輕視了這關鍵性的第二個回合，一位女性朋友自西南方向出現時，你才大有轉機，這位屬馬或者屬羊的朋友對你提出的忠告，都是有益無害的，儘管她也許不會直接了當，正兒八經的提出來。你要留心觀察她的一舉一動，意會她的暗示。她不是神，但神靈會通過她指點你，因爲你相信神明，曾給神發過宏願。
第 22 籤,22,下下籤,巽宮,無妄,初九,否,破破,木,火,土,金,水,木,事相扶，在半途，翻覆終可免，風波一點無。,你想要卜問的的看起來是兩件事，簡直打不定主意要預測哪一件才適宜。只是心偏重於打聽這兩件事到底有沒有危險性，危險的程度有多大、能不能避免？其實，要問的兩件事可以說是—回事，這兩件事又密切相關，互爲因果。絕對不會互相礙事，而是互相補充：事相扶，互相扶持的意思，就像一道甜點心裏加上椒鹽，格會更加爽口一樣。事情的最後結局，終會大事化小，小事化了，直至風消雲散，平平靜靜。 爲什麼？神籤只回答了是什麼。將會怎樣？並沒有答覆過多的提問和解釋。不過，這裏可以透露一點點，此事中的主要當事人，是一個有根基的人，也可以理解成必有天佑的吉人。忠心相助的朋友也有好幾位，而且個個都非等閒之輩。 爲此，你必須去敬拜觀音，這位救苦救難的菩薩。爲了你，也爲了你所牽腸掛肚的人。
第 23 籤,23,中上籤,巽宮,無妄,九五,噬嗑,持平,木,金,火,水,土,木,喜喜喜，春風生桃李，不用強憂煎，明月人千里。,春將盡，夏將臨的季節裏桃樹和李樹都已座上了果子。雖然還遠沒有熟透，卻預示了豐收的信息，能不使人喜氣洋洋嗎？因爲你是這些果實的主人，享有收穫、使用和分配它們的權利。 同時，你也將給衆多的受惠者帶來一份快樂和恩惠。 好在你生性並不吝增嗇，卻是開朗大方、豪爽重義，懂得怎樣回報那些爲桃樹李樹澆水施肥、剪枝除蟲的下級和朋友。不論什麼樣的情緒和不同意見對你產生困擾，你終將端出一個完整而又面面俱到的分配方案來，滿足大家的心願，得到一種皆大歡喜、衆心舒暢的局面。一輪明月朗朗生輝，普照千里，每一個人都沐浴在潔淨無瑕的月色中。 你不用不着爲這一類事而憂慮而煩心了。你在經濟上的收入也許不會特別大，但因爲實施了這種公正的分配方案，受到下屬和朋友的普遍尊重和衷心擁護。你收穫的是人心，金錢買不到的忠心。
