Sign_Order,Sign_Order_Num,Fortune_Level,Palace,Current_Hexagram,Change_Trigger,Changed_Hexagram,Fortune_Category,Five_Elements,Symbol_1,Symbol_2,Symbol_3,Symbol_4,Symbol_5,Poem_Text,Interpretation
第 243 籤,243,下籤,乾宮,遁,九三,否,破,金,水,木,火,土,金,若是有緣人，一指便回首，執迷不悟者，屢引也不走。,響鼓不用重錘，有緣之人只需稍加指點。便能從迷津中回過頭來。但執迷不悟的人。一而再，再而三，每每引領他也不願離開。這樣兩類人形成鮮明的對比，態度絕然不同。同樣如此，即使是同一個人，在不同的人生階段，所執的生活態度也會不一樣。 籤詩的寓意很明白。就是讓你及早回頭，這正合卦。隱遁，退避隱匿之意，識時務者，方爲俊傑。因爲你目前的處境，幾乎已達到本人自身的最高境界，如果還是好大喜功。一心向上，要作過盛之行，必致招災，自取滅亡。倒不如適可而止，適時而退。 激流勇退，方是成功之道。
第 244 籤,244,上上籤,震宮,解,初六,歸妹,持持,木,金,火,水,土,木,月兒升樂，請光可挹，萬里無雲，海天一碧。,籤詩爲我們描繪出一幅海上生明月的幽靜，清明圖景。挹(yi音義)的意思是舀。月光如水，彷彿可以舀，那正是將近午夜之時。 這種環境和時刻，正是你行動的最佳條件，你如今正臨太陰星高照，求名求利諸事皆遂心願，正是心想事成。你追求自己的前程最好離家遠行。在遠方會適時遇上女貴人，抑或得賢妻之助。雖然有此意外事故，但均有驚無險，沒有特大的災難。但對於女性來說，恐怕會有些婦科方面的病情發生，如果在這半年內生孩子的話，需要特別注意保健，防止意外。每逢當月二十六日(農曆)月黃紙牌位。上寫月宮太陰皇后星君，並燃點七枝燭，朝正西方虔誠膜拜，以求大吉。
第 245 籤,245,上籤,坤宮,大壯,九二,豐,持,土,木,金,火,水,土,男兒若得封侯印，不負人間走一遭，功成身退，煙霞嘯傲，脫卻紫羅泡，方是男兒道。,這支籤即是暗示你一生命運。又爲目前的你指出道路。相信與否，照辦與否，當然全由你自己決定。如果你不能照簽意執行，那麼請你牢牢記住這幾句真言，日後必有應驗。你聰明過人，才華出衆，泡糖命中又出現將星，實在難得，你祖上有德，曾經救過數百人性命，必然蔭佑你。所以你有掌權之能，握印之德，衆人皆服。加上你文武全才，建功立業當上爵爺，是可以預料的。“將星文武兩相宜，祿重權高足可知”。 但官位高升，總有一個極阻，你如今有侯爵的級別，應該說是功成名就了，是辭官歸去，遲隱田園的時候了。 想想你的年齡，想想你的後人，思前想後，你應當想通的。 不然，追悔其及呀。 陸游有首《鷓鴣天》詞(家住蒼煙落照間)，你不妨拿來一讀，當可得些啓示。
第 246 籤,246,上籤,坎宮,既濟,上六,家人,持,水,土,木,金,火,水,心月狐狸，迷惑世人，世人不寨，延久傾身。,你頗有心機，詭計多端，愛玩權弄術，計算他人。幾乎沒有人不中傷的奸計，被你利用，被你迷惑，誰也識不破你。你不要高興得太早。這一切僅僅是因爲時辰未到，計高一籌的人哲時還沒有在你生命中出現。 你作這些違背正道的邪術，騙人錢財，玩弄情感，是該收斂的時候了。再不能以“玩世不恭”而自忘詡，更不能洋洋得意，聰明反被聰明誤。 世人不察有神明，人不報應天報應。 如不思侮改，七日內必遭報應！如能即早回頭，尚能有一個可觀的晚景。
第 247 籤,247,下籤,震宮,恆,九二,小過,破,木,火,土,金,水,木,驀地狂風起，大樹盡掀揚，根葉未凋零，培植終無恙。,這場風暴，委實來得猛烈、狂暴，競將大樹連根拔起，吹離了原地。這打擊和挫折，對於等聞之輩可說是致命的傷害，但久經風霜的大樹，卻有着頑強的意志和生命力，根和枝葉還勃發着不屈的生機，你看它們並沒有凋零、萎頓。重新將大樹植根培土、澆水剪枝，精心呵護，終可長成參天大樹。大樹掀揚，大難不死，重遇貴人，實爲有福。樹拔掀揚，本主主人大凶，然而此籤兇中轉吉，並無大礙。 你在營運的過程中，要隨時將自己的處境、綜合的信息和各種微小的變故，向上司或顧問作出詳盡彙報，以求得到正確的指你的名譽雖然受到一定程度的傷害，也會引起不知內情的人產生誤會，但你不要去遷就暫時的輿論壓力，不要介意別人的偏見，讓時間去更正歷史的誤會。
第 248 籤,248,中籤,坎宮,師,六三,升,平,水,命,命,命,命,命,虛日旺相，法要推尋，四周旋繞，對敵衝營。,什麼叫虛日？沒有從事生產、經營，不會產生直接和間接的名利效益的歲月，就叫虛日。歲月磋跎，人事滄桑，虛日何其多，日子何其苦，何其澀。哦，朋友！不要泄氣，不要灰心，不要麻木，更不能沉淪，雖然苦度虛日，卻要看到光明的前景。虛日裏自有興旺，發達的徵兆，路要靠摸索，多加對比參照，反覆搜尋，辦法總是會有的。 “四周旋繞，對敵衝營”，屬於拆字預測法的範疇。這句話拆開再組合得一“呂”字。也就是說，有一個性呂的貴人，將要爲你掃平障礙，帶出一條路子來。值得一提的是，與呂字諧音的姓氏，在《百家姓》中是不可能找到的。 不管經歷多少坎坷與迂徊，你終於會遇上這位貴人的。開始會令你大喫一驚，然後將喜不自勝。
第 249 籤,249,中下籤,坎宮,師,初六,臨,平破,水,木,火,土,金,水,榮枯早定莫嗟傷，辛苦他邦，安享家鄉，爲他人作嫁衣裳，今日君嘗他年改，調別人嘗。,這首籤詩指出了你一生運程的安排，信不信當然由你。當你抽到達支籤的時候，心境必定不佳，爲命運中的失利而嗟嘆不已。其實你根本用不着傷感，因爲一生中的盛與衰、榮與枯早就命中註定，誰也無法改變。成功與失敗，都不是因人的力量可以決定的。誠所成事在天。謀事在人。 你的一生中絕大部分時間註定要在異鄉謀事。離鄉背井，遠居異地，人地兩疏，混得很不容易。而命中正財不足，偏財略有，所以你一直處於一種助手地位，爲人作嫁。到了老車的時候，你終於帶着多年積蓄，迴歸故里，過上一種較爲富裕的生活。 從此結束了幫工的命運。並且運用自己的經驗，指揮手下那批外鄉來的助手們。也許你會認爲命運給你開了一個大大的玩笑吧！
第 250 籤,250,中下籤,兌宮,歸妹,初九,解,平破,金,水,木,火,土,金,女兒大，喜臨門，嫁良人，添子孫，同拜受，感皇恩。,“男大當婚，女大須嫁”，這是我們中華民族的傳統習俗，也是符合天地之道的一條規律。籤詩以兒女長大，嫁配良人，得於添孫。滿門歡喜拜謝皇恩爲題材。爲我們展示出一派喜氣洋洋的吉慶氛圍。令人精神振奮，心倩愉快，透過繚繞的縷縷香菸，我們也許應當還會有所啓發。這支籤正符合“家人”一封，封辭是這麼說：利女貞婦。也就是說，女性佔到此封，或爲女性之事佔得此封，都是有利的、吉祥的。象徵着家中人員，男女各守其位，且治家有方，終會富家大吉，相親相愛，和睦一堂。 那麼，大而化之，引伸到一個單位，一項事業，其意義也很類似。在一種有發展趨勢的情況下，要大膽向縱深方向發展，拓展開事業的範圍，“女大不中留”，否則尾大不掉，終成包袱，拖累。
第 251 籤,251,下下籤,巽宮,噬嗑,上九,震,破破,木,火,土,金,水,木,木生火，口不噤，瘋癲作症，寒熱相侵。,震爲木、離爲火。上震下火。組成的卦名叫“噬磕”。卦辭說：“亨，利用獄。”這一簽，與刑罰，官非一類事物密切有關。籤的主要意義是亨通吉利的。噬磕(shihe音是合)，原指喫食物的兩種方式)，噬有咬和吞的意思。磕即是用門牙咬開有殼的或硬的東西。在勢辭的意思指口中之食，不要輕易吐出來，要臺緊嘴巴，不要暴露。而籤中卻指出。“口不驟”。看來一切都是口舌惹是非闖不利，不吐不行。 有什麼辦法補救呢？“瘋癲作症”，這可是個絕招，讓你裝瘋賣傻，即胡說八道，又不識冷熱亂穿衣棠，寒熱相侵，整個一副神經病的模祥。這樣，你的語言，行動就不能作爲法律的依據，當然可以述惑對方。 你抽得此籤，是爲自己，還是爲了他人？不論怎樣，它對你都是一個警告：緊閉嘴巴，保守祕密，謹記禍從口出。明白處，要多裝些糊塗。
第 252 籤,252,中籤,離宮,蒙,上九,師,平,火,命,命,命,命,命,休休休，過了三年又六週，不猛省，禍到頭。,日常生活，常常聽到這樣一句寬勉的話：算了，過去的事情就讓它過去……這個“算了”，就是古漢語的休字。事情發生在三年一個半月以前。你咬牙切齒，刻骨銘心，耿耿於懷，直至如今。另一種時間計算的說法是經過了三六一十八年。總之。是不少時間了，你還要報仇，還想討還公道。當然，並不能說你的這種心倩完全不對、不能理解，只是報復的時機已經過去了。時過境遷，再行報復，就將惹下天大禍事，於自己不利。嚴重地說。可能是殺身之禍所以必須猛省回頭。 古話說。“人不報應天報應”。對於作惡的小人，必遭天的報應，因爲“舉頭三尺有靈”。 另外，如果多年前的一筆財物。本不屬你，決不要取來佔爲已有，那也是禍根。
第 253 籤,253,中上籤,坤宮,復,六五,屯,持平,土,木,金,火,水,土,欄檻起火，孽畜遭殃，預防得力，滅火成康。,星星之火，稍不留意，會釀成巨大的災禍。那些個牛欄，馬廄、羊圈、豬樓、鴨籠雞奶和狗窩的等建築物，大都是竹木結構，一點就着，一旦燃燒起來，且不危害到牲口的生命？這些畜牲，雖口不能言。其痛苦是可想而知的，畢竟也是一條性命。即算萬幸未被撓死和燒傷；但它們失去了安歇的所在，也會惶惶然不可終日。這裏的“孽”。是指危害，作動詞。當然，如果預防得當的話。又能及時撲滅火星。還是沒有多大危險，得保安康。 綜合看來。六畜是你家庭財產的一個很重要的組成部分，恐怕家產中會有破財的可能。要避免和預防家產的損失，對火的因家要加以提防，千萬不能大意。 火所對應的方位是南方，時間天於是丙、午、丁，季節是夏天。女人不要在夏季離家，向南而行；男人不利接近來自南方的女人，尤其不要涉獵南方之豔。
第 254 籤,254,中籤,坤宮,坤,初六,復,平,土,命,命,命,命,命,已遂心頭願，始知志氣伸，三山須把握，頻頻定太平。,當你抽上這支籤的時候，其實你的心願早已達成，心情是非常高興的。但是不能得意而忘形。雖然事在人謀，成功還在天意。 你在感激上蒼的同時，還須三次以上地把握好“土”這個因素，才能使自己取得的成績一步步得以鞏固。否則，得而復失，終會是空喜一場。 山，積土而成。土，與八封中的“坤”勢對應。這是一個吉利的卦，其封辭大意是這樣：利於乘雌馬出行。君子外出，先則迷途，繼則找到主人向西南可以得到朋友，向東北將失去朋友。若安於守持中道則可獲得吉祥。最終能使你獲益非淺的，是一位西南方向的女性貴人。 你在夏秋之季要留意選擇服飾的吉樣色：黃，忌穿青色的服裝。
第 255 籤,255,上籤,離宮,離,初九,旅,持,火,水,土,木,金,火,福星照映，柱子香聞，滿天星斗，光耀逼人。,桂於飄香，時在三秋。加上有福星高照，成功勢屬必然。但星月爭輝，太陰星不夠顯耀，吉中也帶三兇，星光逼人，眼花潦亂，一時昏朦。難免有些擔驚受怕。但此籤意終歸大吉，有驚無險，不心過慮。 最大的阻礙，來自“天狗星”。 原來使你受此驚嚇的，是來自東北方向的一位屬狗的人他(她)生於冬春之季，個性看似隨和，易與人相處，但內心卻相當固執，殘酷。 而一位屬牛的朋友，會在你慌亂之時挺身而出。爲你解脫危難，終使浮雲散去，重露光華。 摩訶般若波羅蜜多心經是佛道第一要義，其咒語如下，請用心記住：揭締揭締被羅揭締波羅僧結締菩提笑婆訶。 此咒語妙處無窮，你在心慌意亂之時，要反覆吟誦，可很決鎮靜下來。
第 256 籤,256,下籤,離宮,渙,九二,不雅,破,火,土,金,水,木,火,東南地將，來自故墟，燕薊地倉，生無存濟，若要大奮雄心，水源不知何處。,這支籤指導你發達的方向。什麼方位最佳、吉利。什麼地方是絕地，走不通。均一一講明，你要認真對待。其中方位，均是相對而言，出發點是你的籍貫地。你這位將爺，怎麼到河北河間府這塊地面來了？這是你的絕地呀！你的籍貫在燕、薊地區的東南方位，遠着呢。你背並離鄉到這兒，真是投錯了方向。你的最佳方位，應當是沿着黃河，逆流而上，遠遠的西北黃土高原，纔是你用武之地。在那兒，你將建功立業，名利雙收，並且諸事順遂，一帆風順。 你生命的保護神，正是白虎和玄武一雙天神。獨在異鄉，你要多多保重，留意頭部的傷害和疾思，注意飲食的衛生。 不要喫馬肉。回族兄弟可交，且必爲肝膽相照的生死朋友。
第 257 籤,257,中籤,巽宮,益,六二,中孚,平,木,命,命,命,命,命,死有日，生有時，何事漫躊躇，飄然一往，心上無疑。,天長地久。天地不主自己而生存，所以能長久存在。人卻不能，有生也有死。而人的生存期有多久呢？這得因人而異。有些人壽高百歲，尚能健康快樂地活着。而有些人襁褓裏便夭拆了。爲什麼會有這麼大的差距和區別？人類無法掌握自己的命運，也就無法決定生命的起始和終結，否則便是逆天道而行。 比如說自殺。便也有未遂和成功兩種結果，給自己及周圍的人們和親友，留下殘酷的陰影。生死有定，我們只能順從天意，在有生之年奮力謀事，瀟灑爲人。 面臨着一樁極普通極平凡的事，你卻認爲複雜無比，心中猶疑不定，怕這怕那，甚至覺得將威脅到你的生命安全，實在是沒有必要。你應當輕鬆一些，瀟灑一些，置生死於度外，飄然前往。 這樣，你在謀事的過程中，纔不會感受到來自內心的壓力，因而獲得有益的成就，並積累一次成功的經驗。 此事天生死之兆，絕無大礙，只管前行。
第 258 籤,258,中籤,離宮,旅,六五,遁,平,火,命,命,命,命,命,往來行僻處，狡然着一驚，豺狼若當道，斬滅方稱心。,來和去走的同樣險峻、偏僻的小道。這句話寓意着所幹的事情，從人手到完結，都將以特殊的方式進行，也就是不按一股的常規途徑。你認爲越保密，越神祕就愈有安全感。這種方式是否有十足的成功把握呢？ 有一次以上的巨大阻力，那就是讓你碎然之間，大喫一驚的豺狼。它齜牙咧嘴，擋住了你歸去的道路。豺狼當道，是指有盜賊來犯的兆頭，黑道勢力在你所謀的事中即是你依賴的對象，同時又是造成對你直接威懾的力量。這只是時間的轉換造成的不同因素。江湖道上，雖說是義字當先，但翻臉不認人的事。也是經常發生的。這個黑社會人物，屬狗。此人曾也是官場人物。 對社會各階層都很熟悉，交際也很廣泛，你要戰勝地，“斬災”他的癡心妄想，狼子野心，不是一件很容易的事情。 但是，你一定要有戰之必勝的信心。
第 259 籤,259,上籤,坤宮,臨,初九,師,持,土,木,金,火,水,土,八門分八位，九星布九方，責赤黃白黑，五色卷錦裝，交鋒對壘，兩兩相當。,奇門遁甲是一個很複雜的佔油門類，原理較難掌握。在它的排局中，有九宮、六儀、三奇，以及八門、九星、入神之分。這首籤詩表示了它所揭示的信息，是由奇門遁甲的測算法則來提供的。八門在奇門活盤上的中盤上按順時針方向旋轉，是這樣排列的；休、生、傷、枚、景、死、驚、開。而佈於九方的九星則分別爲：蓬、任、衝、輔、英、菏、柱，心、禽。而九星又分別賦以各種不同的色彩爲：白、黑、碧、綠、黃、白、赤、白、紫。八門中以五行爲推佔事物，這裏所說的交鋒對壘，兩兩相當，便是結論：內外均有坑坎缺陷，三奇入墓爲闇昧無光彩之物，美而變醜，其中火煉之物得而復失。如佔婚姻，相剋相沖，婚事難成，成了也難以美滿。不論凰求風。還是風求凰。皆爲相剋。不吉。 其它佔部，如人口走失、失盜、疾病、訟事均爲兇，愁眉不展，抑鬱難伸之格局。
第 260 籤,260,中籤,巽宮,蠱,九三,蒙,平,木,命,命,命,命,命,終身不習上，在世卻枉然，輪迴終不永，落入深坑塹。,這支籤是贈給一頑皮的不學好的人，雖然責罵得很兇，目的還是勸人主善，希望能引以爲戒，早日回頭，方是幹岸。死到臨頭了還不學好，不求上進，活在陽世間豈不枉然嗎？下一輩了，你也變不回人，永遠墮入罪孽深重的坑塹。爲罪鬼、爲畜牲。因爲這一切都是你必將應得的報應。 按佛經的說法，六道輪迴，生生死死，水無休止。只有被打人十八層地獄的罪孽靈魂，才永世不得超生，這是因爲在世不能多做善事，反而盡幹傷天害理之事的結果。 “不修今生修來世”，雖然是一種消極的人生態度，但也不失爲一種自我修身養性、明哲保身的人生觀，值得某一類人斟酌、體味。 積德行善不但是爲了來世的福緣，也是今生作人的起碼標準，望好自爲之。若能戒除貪慾，勿存害人之心，心有好報。
第 261 籤,261,下籤,坤宮,臨,六三,泰,破,土,金,水,木,火,土,兩個子女，同到齊行，陽陽和合，謀作歡欣。,這是一支喜加喜、大吉大利的籤，值得欣慰。兩個子女，爲好上加好。女旁作子，當爲好字。好事成雙，雙喜臨門，豈不美哉？ 陰和陽，兩兩相當，均衡合適。便會產生出圓滿、美好的結局來。這種結合，是最佳的合作方案，成功是肯定的。 此籤不論是佔問婚姻還是事業的合作者，都是成功的，並趨向大吉，特別是針對年輕一代的人，對初婚和初次與人合作謀事的人，更是適合。 “兩人同心，泥土變金”，又道是：“生意易作，夥伴難邀”。只要齊心合力，定會無往而不利。 問及其它諸事，均屬上上大吉，其中關鍵出力人物，均爲一對年輕男女。有了他們的參予，一切都會順遂。
第 262 籤,262,上籤,震宮,隨,九五,震,持,木,金,火,水,土,木,中有玄機賦，雞鳴方顯露，猛然悟禪關，打破君門路。,你要從門卦路斷的困局中闖出來，光有這個願望還是不夠的。必須在關鍵的時刻、有一個關鍵的人、給你提醒、你纔會從夢中驚醒，看到一條金光燦燦的大道。這是一個什麼樣的人呢？你當然很想知道。你也應當知道，這樣多少有個心理上的準備，免得失之交臂。 “雞鳴方顯露”提示的顯露玄機的時間和人物。雞鳴五鼓，正是黎明即將到來之時，十二時辰中爲辰時，辰生寅卯而克已午，寄旺於四季(季春、季夏、李秋、季冬)最後一個月，即農曆三、六、九、十二月。而這位貴人雞年生(1945、57、69年)。男性。此人少年時勞碌霜雪，中年豐厚有餘、爲人春風和氣，利官近貴，多重情義。 你的前程。只在此人身上，你可往西方求之。
第 263 籤,263,中籤,兌宮,困,初六,兌,平,金,命,命,命,命,命,數尾金魚舌餌，絲竿鈞了回頭，家貧翻慊太費，五湖四海邀遊。,“君子愛財，取之有道。”這個道，就是正道，正正當當的謀財方式和手段。而以不正當的手法。非法謀取，巧取豪奪，據爲已有，這種“致富之路”，人稱黑道。因爲背離了職業道德，背離了君子的準則，這種不義之財又稱爲“黑心錢”。所以，錢財對於世人採說，又有了“份內”和“份外”的區分。這支籤給我們講述了一個妄取份外之財的小故事。 幾條美麗的小金魚，受不住餌的誘惑，落人了垂釣者手中。 垂釣者看看沒人，掉頭便走。可是他卻無福消受，因爲自己連個像樣的魚缸也沒有，又買不起，只好用陶鉢湊合着養。在那空蕩蕩的客廳裏，愈顯出主人的寒酸和窘迫，招來非議、盤問和譏諷，也有人在暗中盤算打它的主意。這個人從此內心不得安寧，最後只好將金魚倒下江河，讓它們五湖四海去遨遊。
第 264 籤,264,中籤,坎宮,豐,六二,大壯,平,水,命,命,命,命,命,卯月兒出林，午時正福神，卯生於寅，方見天心。,通常說來，卯日是出行、遷宅、開張開市、簽約的黃道吉日，諸事皆宜。卯爲東方木，棟樑之樹，出於山林，正當造就之時。前程無量。升遷之喜，只在日前。具體哪一天卯日，在民俗曆書《萬年曆)中一查便知。 吉福神在這一天裏午時(中午Il一13)臨照，午時正，或正午時，指的是12點。木生火，卯木生出午火來，正是極爲旺盛的徵兆，方位由東轉向南。這個時十二月面甫而坐，正好迎神納福。 看來，你已處於人生極盛的運程。若不繼續扶植、培養寅的本元，使好的運期延長，恐怕將由此漸漸走向衰勢。因爲卯生於寅，忽略了這一點，通天路斷，難見天心。 寅，骸骨的象徵。正月陰氣動，出陰。這是一個最應重視的準備階段。作爲時辰，也正是早上三至五時，軍事上常用來作爲偷襲攻擊的最佳時間，打響第一槍。
第 265 籤,265,下籤,震宮,豫,六三,小過,破,木,火,土,金,水,木,日中不決，月到方明，一場好事，六耳同成。,當日發生的事情，當天就得去解決纔是。不能拖，一拖就會出亂子，後患無窮。待到不可收拾的那個日子，才明白這個道理，豈不是太晚了。這支籤詩要說的是你必須當機立斷，懸而待決的方針是錯誤的。 事情的結果應當是極好的，特別當你在與“六耳”合作的情況下。 《五燈臺元》中有“六耳不同謀”的說法：“洪州涵潭法會見禪師，問如何是祖師西來意，馬祖讓他低聲，又示意他走到跟前來再告訴。泐潭便走到馬祖身邊，馬祖猛然打了他一記耳光，又說：“六耳不同謀，且去來日來。”泐潭如果當時不能頓悟禪機，這個耳光豈不是白提了嗎？ 事到如今，你也只好尋找第三個人去共同策劃這件事了。 這位聰明的先生性中還是姓孫？或者姓候、胡的話。那就沒有離譜。
第 266 籤,266,下下籤,乾宮,剝,上九,坤,破破,金,水,木,火,土,金,狐宿是妖星，猿猴及樹精，入山遇此曜，迷了性和心。,此籤預示有不祥災厄，主人被妖星狐媚所惑，利用婦人(猿猴)生出咕是非，鬧得家宅不寧，疾患叢生纏衆人，以致嚴重到心性迷亂，精神恍惚，難以根治。追查九星，二十八宿，都沒有狐的地位，它只是一顆隱藏不露的妖星，崇曜罷了，但它的力量較凡人來說，也並不微弱，竟然能驅使猿猴和樹精(招搖術神)掀起一場口舌是非軒然大波。昆爲山，人山是指明瞭良所對應的方位：東北方向，並預示出對頭人爲狗年(成年)出生，女性火體之人。 要制使此人，滅其氣焰，須求成於年生一位男性武人，方能湊效，戊於年爲公元1948年，此人身體屬寒，水性當然，最好能在事發之婚，便求訪此人救助，尚可免卻，臨頭大禍，不然，有遲慢之慮。
