Sign_Order,Sign_Order_Num,Fortune_Level,Palace,Current_Hexagram,Change_Trigger,Changed_Hexagram,Fortune_Category,Five_Elements,Symbol_1,Symbol_2,Symbol_3,Symbol_4,Symbol_5,Poem_Text,Interpretation
第 99 籤,99,上上籤,坤宮,坤,六三,謙,持持,土,木,金,火,水,土,打起平生志，西南好去遊，腰纏十萬貫，騎鶴上揚州。,命裏六親無靠，祖業難留，宜早日離鄉別祖，或出宅外姓。男兒志在八方，但何方得利？西南方向最爲相宜。女性若能隨夫出門，西南方位格外得法。 遊歷西南，詩書可讀，文明可求，非官非吏，均爲平穩；手藝共營生，尤屬相宜。若經商唯防東北方位小人暗中計算，艱難處要有恆心，莫染賭嫖劣習，方可大發。 四旬之後，當步人青雲，腰纏十萬。那時候，便可攜家人，迴歸故鄉，榮宗耀祖了。揚州，古九州之一，爲東方歷史名城。此處揚州泛指江浙皖一帶，以作故鄉的代名詞。 此籤關鍵處爲指示方向：西南。 西南方位爲坤，家宅、婚姻、生育、求名、交易、出行均有利。 疾病如腸胃一類毛病，不可忽視；官訟可理順，當解散。姓字中帶土字者爲吉人。
第 100 籤,100,中上籤,艮宮,損,初六,蒙,持平,土,木,金,火,水,土,喜喜喜，終防否，獲得驪龍頷下珠，忽然失卻，還在水裏。,否，是個多音字，在這裏不念否定的否，而要念成痞子的痞。有一句成語，叫否極泰來，意思是說，壞的運程到了盡頭，好的就來了。否和泰都是易經六十四卦中的卦名，否是差劣的卦，泰是好的吉利的卦。 這裏向你提示了目前的處境，還在否的階段。不論表面上多麼喜慶，還是存在危機。那怕你取來黑龍頷下的那顆珍珠，也沒有什麼值得慶幸的，因爲傾刻之間，又會失手，掉下深水裏。 得而復失，你永遠無法再找到它。況且緬龍失珠，尋仇報復的可能性，也不能排除。 你真是夠否，夠倒捐的了。但這種背運，不會太久了，因爲物極必反，否極終究會泰來，沒有什麼好懊喪的。
第 101 籤,101,中籤,坤宮,泰,九二,明夷,平,土,命,命,命,命,命,國有賢士，廷無佞臣，干戈不用，常享太平。,國家安定團結的局面，實在是百姓的洪福。這種太平盛世的標準是什麼呢？第一是有無數德才兼備的精英，爲國效力。這種人，古代稱爲賢士，他們是清廉公正的各級官吏。第二是最高領導機構——朝廷，即中央政權內，沒有貪贓枉法、奸佞狡詐的大臣。 這樣便會形成一個政通人和、百業俱興的局面。朝野之間，上下一心，國富民強，任何外敵也不敢冒然侵犯，國內也不會發生內亂、分裂，那些個武器(乾和戈都是指武器，也有戰爭的意思)，還派得上什麼用場呢？ 國是這樣，一個單位是這樣，一個家庭也是同樣的道理。
第 102 籤,102,中下籤,乾宮,否,上六,萃,平破,金,水,木,火,土,金,泰來否已極，諸事莫憂心，但須培養無福，做些好事，行些方便，一點丹靈，獨得真傳。,泰和否，都是易經六十四勢中的卦名，否是極差劣的，泰是優秀的好卦。這兩個卦是相連的，事物達到鼎盛，就要開始走向衰落。物極必反，泰盡否來、否極泰來，便是這個道理。一個好的開端終於來臨了，你對目前所有的不如意事都不必介意，不必憂慮。 好的運道來臨，並不是意謂着自己不作任何努力。首先是培養自己的元福。元福是與生懼來的，但後天的培養，只會使元福更鞏固更增添。這也和元氣對人的身體—樣，需要後天的鍛鍊，修身養性。培元培福，完善自己，就是要多做些好事，與人爲善，儘量給別人帶來方便，造福於一方，造福於世人。 這樣你就不難得道，達到天人合一的佳境。
第 103 籤,103,中上籤,離宮,同人,九三,無妄,持平,火,水,土,木,金,火,民樂業，官吏清，太平盛世，復見如令，告諸人，千秋鴻業，仗此望明君。,百姓們安居樂業、無憂無患，官吏們清廉公正。秉公執法，這樣，太平盛世，如今又將出現了朋友，讓我告訴你們：不管你從事的是哪一類偉大的事業，不管你開創了多麼驚人的業績，這事業的發達和興旺，都是與國家的命運和前途分不開的，國富而民強，國強民才壯。我們千秋鴻業的命運與祖國連在一起。我們需要加強廉政建設，也要爲祖國、爲民族作貢獻。 先有國，而後有家，有了家纔有了我。 朋友，你爲國、爲家，爲這個時代做了些什麼？
第 104 籤,104,上上籤,震宮,升,九二,謙,持持,木,金,火,水,土,木,安如泰山，穩如盤石，放膽前行，中通外直。,這支籤的意思，與良卦相符。有泰山爲靠，後臺很硬，當然穩如盤石，也可以說基礎紮實、堅牢。良如山，爲守爲止，以不變應萬變，固守中道。而後發制人，無往不勝。這便是你在這樁事中應取的戰略方針。前行須放膽，戰術上要講究外直而中通。直爲執着，不變，不曲不折；通爲變通，圓通之意。 對內對外的戰術，待人接物，都需區別開來纔是。 坐守東北，面向西南，先靜後動，直取勝利。事有阻滯時，有帶土、山偏旁貴人出面，皆可迎刃而解。 吉祥色彩爲黃色、核黃、杏黃。 問及婚姻，阻隔難成，成亦遲，但可謂好事，不爲不利。 提防四肢指、趾的傷害和疾息。腳氣毛病，暫緩治療。
第 105 籤,105,中上籤,坤宮,比,初六,屯,持平,土,木,金,火,水,土,月中有丹桂，人終攀不着，雲梯足下生，此際好落腳。,看似高不可攀，好事難成，幸有云梯當工具。結果怎樣？桂在月中，桂下月上。桂爲巽月爲坎，巽下坎上，是爲“井”卦。 井卦的意義是這樣：井養萬物，所以人們雖然改換了地方，也不會改變飲水的習慣方式。井卦，它象徵着雖然慾望無窮，但結果卻增加，也沒有減少，無失有得，井水無窮，水不枯竭。如果沒水，已至井臺，在繩還沒有離開井口時，汲水的吊桶鉤阻猶而翻覆，就不能汲到井水，那就是“不達”的兇災了。 所以，縱有云梯空架，最終卻無法達到月宮，香噴噴的“丹桂”也就攀不上了。雲梯的作用也就僅僅只是懸落落腳，讓你得到一點安慰和希望，得到安全感，並順勢撤離險地。 這世界好無奈，不是人人都能成功，也不是事都能達成。如果是這樣，不要怨天尤人，須順從天意。
第 106 籤,106,中上籤,離宮,大過,九二,鹹,持平,火,水,土,木,金,火,天間一孤鴻，嘹嚦嘆主羣，試問如君者，而令有幾人。,人在一生中，總有需要單獨呆一會兒的時候，讓自己享受短暫的寧靜；或者集中精力，發揮思維的能量；或者體會真實的情感，幸福的回億……但人卻不能陷入孤獨。長時間的離羣索居，那是很可怕的，寂寞令人沮喪，可以將人的意志摧毀，最終致人於絕地。人總有三親六故，可是對於有些孤獨無靠的苦命人，卻六親無靠，妻子(或丈夫)無緣，朋友難交。作事諸多顛沛，東營西謀，一事難成。孤獨的命運造成了孤僻的性格，孤僻的性格又帶來了無緣的人生，如此惡性循環，終致失敗的一生。 人是需要互助，需要朋友的。只有把自己完全交給朋友，也才能完全擁有朋友，這是沒有條件可講的，君不聞，情義無價？ 所以，你要營謀得法，必須徹底調整自我封閉型的心態，擴大交際範圍，多搞些公關活動，投身到羣體中去踏踏實實幹事業，不講價錢地多作奉獻。
第 107 籤,107,中上籤,巽宮,頤,初九,剝,持平,木,金,火,水,土,木,紅葉無頹色，凋零一夜風，鄰雞醒午夢，心事總成空。,瀟颯的秋風，一夜之間竟將紅葉糟踏得破敗不堪。良好的願望，就象白日的美夢，被鄰居家的雄雞驚破。 自古紅顏多薄命，不幸的原因之—，就是因爲美麗賢慧而遭到妒忌的暗箭——風言風語的攻擊。巽如風如雞，五行屬木。 這種毀滅性的打擊可以理解爲所有人爲的口頭信息，比如：錯誤的命令、壞消息、挑撥離間的饞言、誣衊、誹謗、恐嚇、虛僞的甜言蜜語…… “巽在牀下，喪其資斧。”後果是不吉利的。有喪失資財的可能性，好事成空，轉爲敗局。 此籤要求我們，謹防來自東南方向的女人和一個儀表整潔的文人，此人是一個油滑的小官吏，姓氏中帶有草木偏旁。在你家裏，室內不要擺花草盆栽，也不要張掛那種招風的山水樹木雞禽圖畫。事情最終還要靠較高職位的官員，爲你說話，化解兇藪。
第 108 籤,108,中上籤,巽宮,頤,六三,賁,持平,木,金,火,水,土,木,事如麻，理多錯，日掩雲中，空成忱擱。,事情紛亂，矛盾叢生，交相關連，錯綜複雜有如亂麻一團。越想動手清理、擺平，越加添亂，變得更糟。爲什麼呢？因爲太陽被烏雲遮住了，天昏地暗看不分明，所以勞而無功，白白地耽擱了許多時間。 日掩雲中，展示的是那種卦象呢？離爲日，昆爲雲。離爲主體，昆爲客體，離上昆下，組成“旅”卦。 旅，是有小亨通的。出門在外處處難，但如能守正就能獲吉。事桔也就能順理成章地辦好，什麼麻煩都可以解決的。不要計較小事，露出窮酸的小家子氣，讓人看不起，以免招災惹恨。 只有不卑不亢，纔會受人尊敬。過於傲慢，也是別人不能容忍的，更不能反客爲主，不尊重主人的權利。多多與主人聯絡，勾通感情，取得信任，最終當如願以償。 重大關鍵問題應當考慮再三，不能輕易答覆，其它問題一律報以好、好、好。
第 109 籤,109,下籤,坎宮,既濟,六二,需,破,水,木,火,土,金,水,勿上舊轍，甘駕新車，東西南此，穩步康衢。,轍，車輪的印痕，也表示道路。不要走老路，也不要使用舊的方法。雖然新的路子自己並不太熱悉，尚缺乏經驗，重新開出一條路是對頭的。衙，四通八達的道路，這一地點可以理解爲十字街頭。穩穩當當地在中心點(十字街頭)上原地踏步，這樣東西南北不論何方，都是寬廣而通達的。 這支籤回答了同一問題中的兩點：第一，不要用舊的方法，也不要幹那些幹過的事情，合作伙伴及使用人員也以新的爲好。 第二，辦好此事的準備工作中，應當有一段時間的多方位論證、探討。這段時間內，不宜向任何方位進取，靜中求安，靜中求穩，靜中求吉。只有在居中的靜態中，你才能悟出成功的真諦和訣竅，也才能四通八達。 只有節制約束事物，使其陰陽之間保持相對平衡，正位居體，才能“暢於四支，發於事業，美之至也”。
第 110 籤,110,下籤,離宮,未濟,九四,蒙,破,火,土,金,水,木,火,夜夢被鼠驚，醒來不見人，終宵廢寢，直到天明。,一夜緊張、驚險，不啻於參加激烈的槍戰、打鬥，又累又伯人，根本就沒有得到片刻的這寧。原來是一隻該死的老鼠，真是煩死人，害得我整夜沒睡個安穩覺。這是一個生於鼠年，或生於決定性格的子時的人，在給你寧靜的歲月增添麻煩，爲你的家庭帶來驚擾。你認爲你是這個家庭的主人，這隻鼠卻認爲你是在它的家裏，主客之位相錯。至少白天是你的，而夜晚，那是他的世界。你的被驚被擾，困頓疲乏似乎與他無關，他纔不要負任何道義上的責任。 傳說鼠也是一個“消息靈通人士”，它的奔忙，是向你報告特快專遞的祕密。而這條祕密也會讓你憂心如焚，輾轉反例，不得入眠。如果鼠族忙着搬家，那就是地震、洪水等災難要來之前的徵兆。白鼠象徵貴人出現。鼠在啃咬衣裳，則意味着你將要滿足一樁心願。
第 111 籤,111,上籤,離宮,訟,九二,否,持,火,水,土,木,金,火,秋霜肅，夏日炎，新花鮮了舊花淹，世情看冷暖，逢者不須言。,此事於夏秋之季，多不吉利。新花稀稀落落，舊花殘敗，正是換季之期，青黃不接之運程。這個時候、你會常常看到人家的白眼、霜臉，處處遭際冷遇，缺少朋友緣份，與早期大不相同。人情似紙張張薄，一捅就破。曾經抬你捧你的人，如今都冷嘲熱諷，或者掉頭而去，或者隔岸觀火，漠不相關。這種時候去求告於人，簡直不要開口，既無益處，反生煩惱。是那相知的人，古道熱腸，不用你開口也會主動幫助的，正所謂“疾風知勁草，極蕩識忠臣”。爲今之計，唯有自己救自己。萬不可因一時挫折，便心死如灰、倒了志氣。密地裏作好諸般準備，養足元氣，調整體能，只待明春春雷滾動，再重新奮起。 “江東子弟多豪俊，捲土重來未可知。”
第 112 籤,112,上籤,離宮,旅,九三,晉,持,火,水,土,木,金,火,未展英雄志，馳驅不憚勞，敢將休咎卜，西北奪前標。,雖驛馬星動，勞累奔波，卻收效平平，名利微微。縱有凌雲壯志，目下尚不能伸，令英雄氣短。箇中原委，尚未能明，以下疑團百結難解，便問神明。如今爲君提醒：方向錯，滿盤輸，徒耗精力意難舒。你那名祿的吉祥方位在西北方向，可是你卻南轅北轍，豈不空忙？休與咎，均爲項圈學術語，意思是失敗和小災患。這裏指卜問磋跎的原因，並預卜發達的方向。 乾所對應的方位正是西北。乾性健行，如馬，五行局金。這類人物剛健武勇、果決、多動少靜。多爲公門中人，姓氏中多帶有金旁及馬、劍等兵刃利器，此爲扶助你的貴人，可求可交，可信可託。 奔赴西北方，忌食馬肉珍物及魚禽之首，辛辣之物也宜少喫。保護頭部、五官。有小患要及時治療，不可拖延時日。 求財宜動，得利於出門。金屬物資和玉器古玩類，獲利頗豐。
第 113 籤,113,中下籤,震宮,震,初九,豫,平破,木,火,土,金,水,木,痾染沉沉，終日昏昏，雷門一震，休健身輕。,痾，也就是疾病。這場傳染而患的疾病，有一段日子了。病勢也不輕，拖到如今，終日裏神志昏朦，僅存一息了。但畢竟不是本身器質性的毛病，還沒有達到要命的程度，故有救，有體健身輕的那一天。當然條件是：雷門一震。此籤可以問病，亦可回答其它事務，如：賭博惡習、被人牽涉的官司是非、人事糾葛、不育、於嗣等等都可悟出同一道理、答案來。易經八封中的震卦，正象徵雷。雷神逢春而動，如末逢驚蟄鳴雷，預示雨水過多，恐有悲楚失望。但能捱過農曆二月頭七日。爲大吉，災星化了，東方護神青龍大神，將爲你驅趕災禍。 足，肝之疾及驚恐，均無大礙。 第一要斷絕傳染之源，不宜再交往。孕婦慾望保胎健胎，均應斷絕房事。不孕者在二月初二前也要絕斷。 第二、貴人來自東方，家中兄弟排行老大，籍貫爲山區人氏，姓氏中帶木旁。吉祥色彩爲黑青、綠碧。 第三、驚來勿亂，亂則險生。
第 114 籤,114,下籤,艮宮,艮,六二,蠱,破,土,金,水,木,火,土,易非易，難非難，忽地起波瀾，歡笑兩三番。,此事爲何非易非難呢？因爲易中有難，難中有易。順利和阻逆是互相轉換的，過渡的。所以，不論處於順境和逆風中，都要認清形勢，加強應變的心理準備和能力。這些變化來得都很突然，出入意外，風波平地而起，反反覆覆，幾起幾落，几上幾下，方能達到“歡笑”的境界。世間一遺蹴而就的事業畢竟不多，一帆風順也只是一個良好的祝願。失敗，振作，挫折，再振奮，一而再，再而三，這樣反覆拼搏，便是成功之道。平地波瀾，有驚無險，能冷靜待之，必可化險爲夷。 巽爲克體，風波多因女人而生。此女印堂青亮，限眶發黑，雖濃妝豔抹，衣着鮮麗、風姿綽約，絕不足近，不足取，宜遠離纔是。留連必敗，慎之再三。
第 115 籤,115,下下籤,坤宮,坤,六四,豫,破破,土,金,水,木,火,土,路不通，門閂塞，謹慎提防，去藏月黑。,走到了一個絕地：路不通，門閉塞，在這個月黑雲翻的深夜裏。夠難爲你了，天不絕人，你總得從這死衚衕裏走出去，置於死地而後生，你也必能從這逆境中走出來。 濃厚的一團烏雲，將月亮團團包緊，天色頓時漆黑，你看不清楚，迷失方向，誤入絕地，也難怪。因爲你沒有預備下夜間照明的燈火，缺少這玩意兒，算是你的疏忽，不夠謹慎吧。 雲藏月，這種天象組成什麼卦呢？坎爲月，良爲雲。坎爲主體，艮爲客體，坎上良下，組成“漸”卦。時辰未到，你卻急功近 利，提前出發，忘記了循序漸進的原則，所以走到了絕地，到一次深刻的教訓。 但你所行幸不遠，迷失不深，尚未釀成災禍。行事需結伴，不可單獨冒進，進展緩侵，終得大吉之局。這便是“漸”卦所要告訴你的。
第 116 籤,116,中籤,艮宮,大畜,九二,賁,平,土,命,命,命,命,命,蝸角蠅頭利，而今已變通，草頭人笑汝，宜始不宜終。,蘇東坡有詞雲；“蝸角虛名，蠅頭微早，算來算着甚奔忙？事皆前定，誰弱誰又強！本籤以經商之道爲例，論及多方，還需細細品味，方能識得真諦。 蝸角蠅頭之利爲數區區，多不爲人重視。若論生意，將本求利，去觀便是求利幾倍幾番，多多益善。這種生意經，如今不行了，變成另一回事兒，那便是薄利多銷，廣種薄收，最終收穫仍是多多，且能長久。你所執的生意方賂就是這樣，也應當如此。 可是遭到一位草頭姓氏朋友的反對和譏笑，認爲你太嫩了點兒，不通生意經。其實這位先生才真是食古不化，不懂得變通的道理。這樣一個時代，不這樣行嗎？他的生意經將是不可能長久的，而且風險值過大，必遭到失敗。 走自己的路，讓大家去嘲笑好了。
第 117 籤,117,中籤,巽宮,家人,六四,同人,平,木,命,命,命,命,命,珠玉走盤中，田園定阜豐，休言謀未遂，此去便亨通。,珠玉與盤，皆團圓之珍物，圓滿而吉祥的徵兆。預測田園土產必定豐足。阜，富足的意思。不要說目的不能達到，這回去了，一定能取得圓滿的成功。西北方向，京都大邑，形勝之地，高亢之所，可望成就。 秋，九、十月之交，戌亥年月日時，正是成功最佳時刻。 飲食禁忌：荔枝、掛園(龍眼)等圓型果品，諸物之首，海鮮及肝、膽、腰等下水。 西北成名有望，大權可攬，宜人京師。 吉祥色彩：大紅、玄青色。 若論婚姻，可成，大吉。
第 118 籤,118,中上籤,艮宮,賁,六二,大畜,持平,土,木,金,火,水,土,月已明，花最發，事悠悠，無不合。,月兒已近團圓之象，光輝明亮，皚潔如鏡。花也開得最爲嬌豔，妖媚動人。正是花好月圓，諸事稱心遂意的吉兆。而且好事能夠存在相當長的時間，悠悠遠遠，沒有什麼不合符天時地利人和的。陰陽平衡、剛柔相濟、和諧長久。月華高照，上得女性貴人照應，春夏之交，三、五、八月日時，如蛇年中四月，均爲大吉告成之喜期。 月上花下，坎上震下，正是“屯”勢。屯針具有元始的亨通之象。花在開始萌芽時，有些艱難和挫折，因爲此時很脆弱，柔嫩，要好好呵護，不能給它任何傷害。過了立春、雨水以後，就開始茁壯成長，生命力也旺盛得多。 此籤問到婚姻的結合也是這樣，逐漸定向成功，走向牢固，越往後面越幸福、美滿。看來婚姻動得過早，但並不一定都是壞事，要因人而異。
第 119 籤,119,中下籤,坤宮,臨,上六,損,平破,土,金,水,木,火,土,朦朧秋月映朱門，林外島兒叫寺僧，自有貴人來接引，何須巧語似流鶯。,三秋時節，朦朧的月光映照在紅色的大門上，顯得那麼蒼白、柔弱和無助，朱門，通常用來指貴府、官宦豪門。柔弱女子依附豪門，全仗貴人接引、施恩。鳥兒自由地歌唱着飛出了樹林，遠遠地離開了寺廟，離開僧侶。因爲不願再與那個無慾無求、沒有名份的人共同生活，離家出走了。女子的出走，在貴人看來完全可以理解。所以她用不着過多地解釋，也用不着編出一個巧妙的理由，更用不着自作多情、裝模作樣地去獻媚。貴人會主動地向她伸出溫暖的手，幫助她渡過難關。 這類如逃亡、跳槽、背離、人口走失、失物等項事情，同樣可以悟出答案來。 不管你是那隻自由的鳥兒(離家出走的的女人)，還是那救人於危難的貴人，都須記住這句話：“殺人須見血，救人須救徹。” 幫忙一定幫到底，否則反道無窮後患。
第 120 籤,120,中上籤,艮宮,損,六三,大畜,持平,土,木,金,火,水,土,事來寬，心不安，段慮久，始妥然。,禍事來了，不幸的事態終於發生。那麼面對這種衝擊，一定要沉着、冷靜，客觀而又全面地看待此事。不然就會亂了方寸、心猿意馬，不知如何是好。心裏打定主意以後，就不要反覆，一心認定，一口咬定，這也可說是一錘定音吧。其實這個災禍並不是衝你而來，至少主要攻擊對象並不是你。你將被懷疑相當長的一段時間，你冤枉、你嘔氣，那都是有一定時間的，到後來一切都會歸於相交無事。這種誤會終於會真象大白，但對方卻不會爲此而彌補你的損失，你錯他對，你對他還對，只好不了了之。 面對奪理強詞、強權，一定不要硬頂，心中要寬而又寬，一笑置之。委曲求全、委曲求安在特定的環境中，也是成功之道。
第 121 籤,121,中籤,坎宮,明夷,六三,復,平,水,命,命,命,命,命,虛名虛位久沉沉，祿馬當求未見真，一片彩雲秋後至，去年風物一時新。,只有久困的英雄，纔會抽中這支籤。真是好漢莫提當年勇，提起來感慨萬端，不堪回首。總之是今非昔比了。英名赫赫，已成遙遠的過去。如今空佔着這虛有的名聲和名份，沒有實際的權力。這種沉悶的格局，何時纔是個頭呢？ 祿馬，即爲錢財奔波忙碌的意思。有求財的機會，有得財的可能卻又幻滅成泡影，難以成爲實際的結局，難道背運永無終結嗎？對，朋友，你的好運終於在秋盡冬初時分來臨了。你曾經幹過的事業中傳來了嶄新的信息，你可以憑藉昔日的經驗和名聲，去大展鴻圖，再起東山。 去年，是指過去的歲月，決不要單純理解爲今年、去年明年的那個序數詞。 你要看好西北方向，千萬不能坐失良機喲！
第 122 籤,122,上籤,艮宮,艮,六四,旅,持,土,木,金,火,水,土,止止止，有終有始，似有如花，守成而已。,籤詩以月有陰晴圓缺，花會殘盛開落爲例，生動形象地闡述了凡事都有終和始的規律，到了該結束的時候，就要停止前進，守住取得的成績的道理。守成也叫守中，宜守中道，靜止不動，不偏不倚，不上不下，下左不右的意思。那麼你預測的問題，是不是應當馬上就有了答案？ 易經八卦中“艮”如山。高山仰止，就象一座山橫釐在眼前。 只好停下來，抬頭望着它。不管你在所詢問的事中，處於主動還是被動，都應當穩如泰山，不主動出擊爲好。特別是針對東北方向和冬害之季兩個條件而言。更是應該如此對待。
第 123 籤,123,下籤,艮宮,賁,上九,明夷,破,土,金,水,木,火,土,明月全園，頹色欣然，風雲相送，和合萬年。,此籤問及有關的人事中，如以女性爲主體，則結局將會十分圓滿，而且可能獲得光彩的榮譽，令你感到欣慰。風雲相送，可以說是有人將要在這件事中給予主動的幫助、協力，其結局是相當完美的。 風，在八卦中所對應的卦名卦爲“巽”。“巽”所包含的意思較廣，對人而言是家中長女，又白又高，性格活潑，開朗大方，嗓音園潤，洪亮等等。不管此人是一位獨身女人或者文化人或者宗教人士，都將有效地助你一臂之力。 相傳唐代高僧寒山、拾得二人，從小爲貧賤之交，情同手足，互相關懷，非常和睦融洽。後來被卦爲“和聖”和“合聖”。我國民俗中，以“和合”代表同心和睦、順氣同心的意思，並漸漸成爲婚姻美滿、喜氣洋洋的喜神。 誰不願與自己心愛的人終身相守，美滿和睦，相敬如儐，白頭到老？
